listing_id,search_title,search_price_text,location,url,title,price_text,price,description,is_active,mileage_km,first_registration,fuel,transmission,scraped_at
3427359447,BMW 320 d Touring Sport Line Garantie *Head Up*LED*,15.990 €,52477 Alsdorf,https://www.kleinanzeigen.de/s-anzeige/bmw-320-d-touring-sport-line-garantie-head-up-led-/3427359447-216-1714,Reserviert • Gelöscht • BMW 320 d Touring Sport Line Garantie *Head Up*LED*,15.990 €,15990,"BMW 320d Touring Sport Line Sportlicher und zugleich praktischer Kombi mit Sport Line Ausstattung, gepflegter Historie und umfangreicher Ausstattung. Fahrzeugdaten ✅ Erstzulassung: 08/2016 ✅ Laufleistung: 143.177 km ✅ Getriebe: Automatik ✅ Scheckheft: gepflegt (Wartungen beim Vertragspartner durchgeführt) ✅ Letzter Service: 10/2025 bei 138.913 km ✅ TÜV: bis 05/2027 Ausstattung & Highlights ✅ Sport Line Ausstattung ✅ Business-Paket ✅ Navigationssystem ✅ LED-Scheinwerfer ✅ LED-Tagfahrlicht ✅ Sitzheizung ✅ Park Distance Control vorne & hinten ✅ Freisprecheinrichtung (Bluetooth) ✅ Ambiente-Beleuchtung ✅ Klimaautomatik ✅ Tempomat ✅ 8-fach bereift (Sommer & Winter) ✅ Lackierung: Alpinweiß Wartung & Historie ✅ 28.07.2017 bei 24.478 km ✅ 12.12.2018 bei 51.978 km ✅ 07.05.2019 bei 59.191 km ✅ 09.07.2019 bei 64.890 km ✅ 28.04.2023 bei 115.417 km ✅ 27.10.2025 bei 138.913 km Komfort & Alltag ✅ Geräumiger Kofferraum ✅ Sportliches und komfortables Fahrverhalten ✅ Ideal für Familie & Langstrecke ✅ Weitere Ausstattung und Details siehe Bilder Unsere Leistungen ✅ 1 Jahr Gewährleistung – Sie sind im ersten Jahr nach Kauf gegen technische Mängel abgesichert ✅ Finanzierung möglich – auch ohne Anzahlung ✅ Inzahlungnahme Ihres Fahrzeugs möglich ✅ Besichtigung und Probefahrt nach Terminvereinbarung möglich Änderungen / Irrtümer / Zwischenverkauf sind vorbehalten. - Anmeldeservice möglich! - Bundesweite Anlieferung möglich! Unsere Fahrzeuge werden für den Wiederverkauf professionell aufbereitet und in unserer Werkstatt auf Sicherheit und Zustand geprüft. - Finanzierung auch ohne Anzahlung möglich! - Inzahlungnahme möglich! Sonderausstattung: Alpinweiß-Lackierung (Uni), Außen-/Innenspiegel mit Abblendautomatik, Head-up-Display, HiFi-Lautsprechersystem, Instrumentenkombination (erweiterter Umfang), Lenkrad heizbar, Paketkombination: Business-Paket in Verbindung mit Navigations-Paket ConnectedDrive, Park-Distance-Control (PDC) vorn und hinten, Scheinwerfer LED, Sitzheizung vorn, Sonnenschutzverglasung (hinten abgedunkelt) Weitere Ausstattung: Ablage-Paket, Airbag Beifahrerseite abschaltbar, Airbag Fahrer-/Beifahrerseite, Ambiente-Beleuchtung, Audiosystem BMW Professional (Radio/CD-Player MP3-fähig), Auspuffblende verchromt, schwarz, AUX-IN-Anschluss (AUX-IN), Außenspiegel elektr. verstell- und heizbar, Außenspiegel Wagenfarbe, Außentemperaturanzeige, Bordcomputer, Bremsassistent, Check-Control-System, Durchladeeinrichtung (Mittelarmlehne hinten), Dynamische Bremsleuchte, Dynamische Tractions Control (DTC), Einstiegsleisten mit Einleger in Aluminium, Fahrassistenz-System: Fahrerlebnisschalter, Farbmonitor (6,5 Zoll), Fernentriegelung Heckklappe, Freisprecheinrichtung Bluetooth mit USB-/Audio-Schnittstelle, Fußmatten Velours, Gepäckraum-Abtrennung (Netz), Gepäckraumabdeckung / Rollo, Getränkehalter, Heckklappenbetätigung automatisch, Heckleuchten LED, Innenausstattung: Interieurleisten schwarz hochglänzend mit Akzentleiste, Isofix-Aufnahmen für Kindersitz, Karosserie: 5-türig, Klimaautomatik 2-Zonen mit autom. Umluft-Control, Kopf-Airbag-System hinten, Kopf-Airbag-System vorn, Kopfstützen hinten klappbar, Lenkrad (Sport/Leder), Lenksäule (Lenkrad) mechan. verstellbar, Licht-Paket, LM-Felgen, Mittelarmlehne hinten, Modellpflege, Motor 2,0 Ltr. - 140 kW 16V Turbodiesel, Multifunktion für Lenkrad, NOx-Speicherkatalysator (BMW Blue Performance), Personalisierungssystem (Personal Profile), Reifendruck-Kontrollsystem, Reifensystem Run-Flat (mit Notlaufeigenschaften), Schadstoffarm nach Abgasnorm Euro 6, Seitenairbag hinten, Seitenairbag vorn, Service-System: Intelligenter Notruf inkl. TeleServices, Sitzbezug / Polsterung: Stoff Corner, Sport Line, Sportsitze vorn, Start-Stop-Knopf, Start/Stop-Anlage (Funktion), Steckdose (12V-Anschluß) zusätzlich, Wärmeschutzverglasung getönt , Head-up-Display, Sitzheizung vorn, Ambiente-Beleuchtung Das AUTOCENTER in HOENGEN begrüßt sie gerne zu einer unverbindlichen Probefahrt oder Besichtigung. Eine Inzahlungnahme ihres derzeitigen Fahrzeuges ist möglich. Ständig neue und gepflegte Fahrzeuge im Sortiment. We speak English - Contact us by phone - WhatsApp Unsere Öffnungszeiten: Montag-Freitag : 10.00 Uhr - 18.00 Uhr Samstag : 10.00 Uhr - 16.00 Uhr Wir freuen uns auf ihren Besuch ! Limousine Gebrauchtfahrzeug Hubraum: 1995 cm³ Anzahl der Türen: 4/5 Türen Anzahl Sitzplätze: 5 Schadstoffklasse: Euro6 Umweltplakette: 4 (Grün) Anzahl der Fahrzeughalter: 2 HU: Neu Farbe: Weiß Farbe (Hersteller): ALPINWEISS III Innenausstattung: Stoff Farbe der Innenausstattung: -- Airbags: Front-, Seiten- und weitere Airbags Anhängerkupplung: -- Radio: Tuner/Radio Tagfahrlicht (Art): LED-Tagfahrlicht Pannenhilfe: Pannenkit Ausstattung ABS, Abgedunkelte Scheiben, Alarmanlage, Ambiente-Beleuchtung, Armlehne, Beheizbares Lenkrad, Berganfahrassistent, Bluetooth, Bordcomputer, CD-Spieler, ESP, Elektr. Fensterheber, Elektr. Heckklappe, Elektr. Seitenspiegel, Elektr. Seitenspiegel anklappbar, Elektr. Wegfahrsperre, Freisprecheinrichtung, Garantie, Gepäckraumabtrennung, Geschwindigkeitsbegrenzer, Head-Up Display, Innenspiegel autom. abblendend, Inspektion neu, Isofix, Lederlenkrad, Leichtmetallfelgen, Lichtsensor, Multifunktionslenkrad, Navigationssystem, Nebelscheinwerfer, Nichtraucher-Fahrzeug, Notbremsassistent, Partikelfilter, Regensensor, Reifendruckkontrolle, Scheckheftgepflegt, Servolenkung, Sitzheizung, Sommerreifen, Soundsystem, Sportfahrwerk, Sportpaket, Sportsitze, Start/Stopp-Automatik, Touchscreen, Traktionskontrolle, USB, Verkehrszeichenerkennung, Winterreifen, Zentralverriegelung Inserat bereitgestellt von",False,143177,August 2016,Diesel,Automatik,2026-06-06T23:38:51.695877
3427314501,BMW 320D F30 Gran Turismo,11.990 €,44577 Castrop-​Rauxel,https://www.kleinanzeigen.de/s-anzeige/bmw-320d-f30-gran-turismo/3427314501-216-1998,Reserviert • Gelöscht • BMW 320D F30 Gran Turismo,11.990 €,11990,"Sonderausstattung: Audio-Navigationssystem Business, Ausstattungs-Paket: ConnectedDrive Services, Comfort-Paket, DAB-Tuner (Radioempfang digital), Design- und Ausstattungslinie Luxury, Fahrassistenz-System: Driving Assistant, Fahrassistenz-System: Park-Assistent, Innovations-Paket, Lendenwirbelstütze Sitz vorn links und rechts, elektr. verstellbar, Lenkrad heizbar, Metallic-Lackierung, Panoramadach (Glas), Reifensystem Run-Flat (mit Notlaufeigenschaften), Rückfahrkamera, Sicherheitssystem Active Protection, Sitze vorn elektr. verstellbar (links mit Memory) Weitere Ausstattung: Airbag Beifahrerseite abschaltbar, Airbag Fahrer-/Beifahrerseite, Aktive Motorhaube, Aktiver Heckspoiler (elektrisch ausfahrbar), Auspuffanlage (1-Rohr-Anlage) mit Blende, AUX-IN-Anschluss (AUX-IN), Außenspiegel elektr. verstell- und heizbar, Außenspiegel Wagenfarbe, Blinkleuchten LED, Bordcomputer, Bremsassistent, Bremsenergierückgewinnung (Rekuperationssystem), Check-Control-System, Drehzahlmesser, Durchladeeinrichtung (Mittelarmlehne hinten), Dynamische Bremsleuchte, Fahrassistenz-System: Fahrerlebnisschalter, Farbmonitor (6,5 Zoll), Fensterheber elektrisch vorn + hinten, Freisprecheinrichtung Bluetooth mit USB-/Audio-Schnittstelle, Fußmatten Velours, Gepäckraumabdeckung / Rollo, Heckklappenbetätigung automatisch, Heckleuchten LED, Isofix-Aufnahmen für Kindersitz an Rücksitz, Karosserie: 5-türig, Kopf-Airbag-System hinten, Kopf-Airbag-System vorn, Kopfstützen hinten klappbar, Lenksäule (Lenkrad) mechan. verstellbar, LM-Felgen, Motor 2,0 Ltr. - 135 kW Turbodiesel, Nichtraucher-Paket, Reifendruck-Kontrollsystem, Reifenpannen-Anzeige, Schadstoffarm nach Abgasnorm Euro 6, Schaltpunktanzeige, Scheibenwaschdüsen heizbar, Seitenairbag hinten, Seitenairbag vorn, Service-System: Intelligenter Notruf inkl. TeleServices, Sitzbezug / Polsterung: Stoff Move, Start-Stop-Knopf, Start/Stop-Anlage (Funktion), Stoßfänger Wagenfarbe, Wärmeschutzverglasung getönt Der Wagen ist optisch sowie technisch in einem Sehr guten Zustand . Innenraum sehr gepflegt. Der Wagen ist Voll fahrbereit. Zu Verkaufen Bmw 320 Gran Turismo 320 d - einem neuen Ölservice+Inspektion - Steuerkette Neu gemacht - 1 Hand - Gepflegter Zustand - 1 Jahr Garantie - Finanzierung nach absprache möglich ▪︎ 2 Schlüssel ▪︎ HU/AU Neu ▪︎ 4x FachBereift Liebe Kunden!! - Wir möchten Ihnen gerne schnell helfen, dafür ist es besser drei Minuten lang zu telefonieren, als drei Tage lang E- Mails hin und her zusenden. - Die Darstellung des gebrauchten Gegenstandes stellt kein Angebot im Sinne der §145ff BGB dar.Sie ist freibleibend und unverbindlich. Irrtürmer,Eingabe-Übertragungsfehler sowie Zwischenverkauf vorbehalten. - Irrtürmer Änderungen Zwischenverkauf vobehalten . Der Inserate Könnte Tippfehler bezüglich der Ausstattung und Laufleistungen Dafür übernehmen wir keine Haftung... - Gerne laden wir Sie zu einer unverbindlichen Probefahrt ein! Wir freuen uns auf Ihren Anruf vorab! Kontakt: Für weitere Informationen oder zur Vereinbarung eines Besichtigungstermins stehen wir Ihnen gerne zur Verfügung. MB Automobile Öffnungszeiten : Mo-Sa.: 09:30 Uhr-18:00Uhr Außerhalb der Öffnungszeiten nach Vereinbarung. Unser Service: •Hilfe bei der Anmeldung •kurzzeitkennzeichen •Abholung vom Hauptbahnhof Limousine Gebrauchtfahrzeug Hubraum: 1995 cm³ Anzahl der Türen: 4/5 Türen Anzahl Sitzplätze: 5 Schadstoffklasse: Euro6 Umweltplakette: 4 (Grün) Anzahl der Fahrzeughalter: 1 HU: Neu Farbe: Blau Metallic Farbe (Hersteller): MIDNIGHT BLUE II Innenausstattung: Stoff Farbe der Innenausstattung: Schwarz Airbags: Front-, Seiten- und weitere Airbags Anhängerkupplung: Anhängerkupplung fest Radio: Radio DAB Tagfahrlicht (Art): LED-Tagfahrlicht Kurvenlicht (Art): Kurvenlicht Ausstattung ABS, Allwetterreifen, Armlehne, Bluetooth, Bordcomputer, ESP, Elektr. Fensterheber, Elektr. Seitenspiegel, Elektr. Seitenspiegel anklappbar, Elektr. Sitzeinstellung, Elektr. Sitzeinstellung mit Memory-Funktion, Elektr. Wegfahrsperre, Fernlichtassistent, Freisprecheinrichtung, Garantie, Head-Up Display, Innenspiegel autom. abblendend, Inspektion neu, Isofix, Lichtsensor, Multifunktionslenkrad, Navigationssystem, Nebelscheinwerfer, Panorama-Dach, Partikelfilter, Regensensor, Reifendruckkontrolle, Scheckheftgepflegt, Schiebedach, Schlüssellose Zentralverriegelung (Keyless), Servolenkung, Sitzheizung, Soundsystem, Spurhalteassistent, Start/Stopp-Automatik, USB, Xenonscheinwerfer, Zentralverriegelung Inserat bereitgestellt von",False,183000,Oktober 2014,Diesel,Automatik,2026-06-06T23:38:57.439351
3424170189,BMW 320d M Paket,7.500 € VB,45355 Essen-​Borbeck,https://www.kleinanzeigen.de/s-anzeige/bmw-320d-m-paket/3424170189-216-2033,Reserviert • Gelöscht • BMW 320d M Paket,7.500 € VB,7500,Verkaufe meinen BMW 320d mit 184 ps Das Fahrzeug befindet sich seit 2 Jahren in meinen Besitz und würde immer gepflegt und mit viel Wertschätzung behandelt. Das Fahrzeug ist 8 mal bereift Sommer Reifen ist auf schwarze Alufelgen drauf Winterreifen auf Stahlfelgen Folgende Reparaturen würden in den letzten Monaten durch geführt: Steuerkette mit ventilkopf (komplett ). Erneuert. Rechnung liegt vor !! Ölwechsel Fahrzeug ist angemeldet und wird noch bewegt. Probefahrt möglich,False,249800,März 2011,Diesel,Automatik,2026-06-06T23:39:02.655876
3427729110,BMW f30 320d,12.500 € VB,59909 Bestwig,https://www.kleinanzeigen.de/s-anzeige/bmw-f30-320d/3427729110-216-1356,Reserviert • Gelöscht • BMW f30 320d,12.500 € VB,12500,"Zum Verkauf steht mein BMW 320d F30 in Mineralgrau, Erstzulassung 10/2014. Das Fahrzeug verfügt über den zuverlässigen 2.0 Diesel-Motor mit 184 PS und Automatikgetriebe. Der aktuelle Kilometerstand beträgt ca. 195.000 km. Der BMW befindet sich technisch in einem sehr guten Zustand. Motor und Automatikgetriebe arbeiten einwandfrei und das Fahrzeug fährt sich sehr angenehm. Sämtliche Wartungen wurden regelmäßig durchgeführt. Ausstattung: • Automatikgetriebe • Head-Up Display • Große Navigation (Navigationssystem Professional) • Elektrisch ausklappbare Anhängerkupplung • Sitzheizung • Piano Black Interieur • Multifunktionslenkrad • Klimaautomatik • Mineralgrau Metallic Wartung / Service: • Hintere Stoßdämpfer neu • Getriebeöl vor ca. 10.000 km gewechselt • Differentialöl gewechselt • Regelmäßige Wartung durchgeführt • TÜV bis Juli 2026 Das Fahrzeug weist dem Alter und der Laufleistung entsprechende kleine optische Gebrauchsspuren auf, befindet sich jedoch insgesamt in einem gepflegten Zustand. Technisch gibt es keine bekannten Probleme. Preis: 12.500 € VB Verhandlungsbasis nach Besichtigung vor Ort. Besichtigung und Probefahrt nach Absprache möglich. Bei Interesse einfach melden.",False,195538,Oktober 2014,Diesel,Automatik,2026-06-06T23:39:08.078761
3424158460,Bmw 320d Mit Neu TÜV und Service,20.999 € VB,49525 Lengerich,https://www.kleinanzeigen.de/s-anzeige/bmw-320d-mit-neu-tuev-und-service/3424158460-216-1257,Reserviert • Gelöscht • Bmw 320d Mit Neu TÜV und Service,20.999 € VB,20999,"BMW Touring – Top Ausstattung, gepflegt, TÜV & Service neu Wir verkaufen unseren BMW Touring, Weil wir ein größeres Auto brauchen Wagen befindet sich in einem sehr gepflegten Zustand, ist unfallfrei und überzeugt durch seine umfangreiche Ausstattung sowie den sparsamen und gleichzeitig kraftvollen Ausstattung Highlights: ✔ 190 PS Motor ✔ Automatikgetriebe ✔ Sportsitze mit Teillederausstattung ✔ Harman Kardon Soundsystem ✔ DAB-Radio, USB, Bluetooth-Audio & Telefonanbindung ✔ Panorama-Glasdach ✔ Elektrische Heckklappe ✔ Getönte Scheiben mit Sonnenschutzverglasung ✔ Sommer- und Winterräder auf Alufelgen ✔ LED-Scheinwerfer ✔ LED-Nebelscheinwerfer ✔ Fernlichtassistent ✔ Park Distance Control (PDC) ✔ Multifunktions-Sportlederlenkrad ✔ Connected Package ✔ Ambiente-Beleuchtung ✔ Shadow Line Hochglanz ✔ Ablagenpaket mit Trennnetz Zustand: Unfallfrei Technisch einwandfrei TÜV neu (04/2026) gültig bis 04/2028 Frischer Service durchgeführt Nächste Wartung erst in ca. 24.000 km Nichtraucherfahrzeug Altersbedingt sind einige kleine Kratzer auf der Motorhaube sowie am hinteren Stoßfänger vorhanden. Nichts Gravierendes und rein optischer Natur. Bei Interesse oder Fragen freue ich mich über Ihre Nachricht. Bitte beachten: Es handelt sich nicht um einen Notverkauf. Anfragen nach dem Motto „Was ist letzter Preis?“ werden nicht beantwortet.",False,119000,März 2021,Diesel,Automatik,2026-06-06T23:39:13.064243
3427716633,Bmw 320d xdriv,15.000 € VB,57223 Kreuztal,https://www.kleinanzeigen.de/s-anzeige/bmw-320d-xdriv/3427716633-216-1466,Reserviert • Gelöscht • Bmw 320d xdriv,15.000 € VB,15000,bmw 320d xdrive technisch top zustand ein paar kratzer an die türen,False,126000,September 2018,Diesel,Manuell,2026-06-06T23:39:18.395067
3426166052,BMW 320D 2.0 Disel 2008 TUV 10.2026,3.299 €,46045 Oberhausen,https://www.kleinanzeigen.de/s-anzeige/bmw-320d-2-0-disel-2008-tuv-10-2026/3426166052-216-1286,Reserviert • Gelöscht • BMW 320D 2.0 Disel 2008 TUV 10.2026,3.299 €,3299,"Verkaufe hier BMW 320d aus 2008 mit der 2.0 Liter Dieselmaschine (163 PS) und Automatik. Das Auto hat erst 2 Besitzer und TÜV bis Oktober 2026. Vom Zustand her ist er echt super, vor allem technisch: Motor und Getriebe laufen einwandfrei und machen überhaupt keine Probleme. Natürlich hat er über die Jahre ein paar normale Gebrauchsspuren und Kratzer abbekommen. Zu den ehrlichen Mängeln: ​Vorne auf der Fahrerseite schlägt ein Lenker ganz leicht. ​Hinten links ist eine kleine Delle – kann man aber easy per PDR (Beulendoktor) ohne Lackieren rausholen. Ansonsten ist der Wagen top in Schuss und fährt sich super. ​Bei Fragen oder Interesse an einer Probefahrt einfach kurz melden!",False,237000,Mai 2008,Diesel,Automatik,2026-06-06T23:39:23.378490
3427658565,BMW 320D Bj 2008 Automatik in sehr Guten Zustand El-Schiebedach,5.690 € VB,52353 Düren,https://www.kleinanzeigen.de/s-anzeige/bmw-320d-bj-2008-automatik-in-sehr-guten-zustand-el-schiebedach/3427658565-216-1770,Reserviert • Gelöscht • BMW 320D Bj 2008 Automatik in sehr Guten Zustand El-Schiebedach,5.690 € VB,5690,"Verkauft wird BMW 320 Diesel Bj 2008 Automatik Getriebe in sehr Guten Zustand. Zentralverriegelung,Elektrische-Schiebedach(Panorama Dach),Servolenkung,Tempomat,Sitzheizung Vorne,Multifunktional-Lenkrad,Außenspiegel elektrisch einstellbar und klappbar usw. Neue Frontscheibe,Neue Batterie,neue Allwetterreifen mit sehr Schöne schwarze Alufelgen,Öl und alle Filter vor kurzem gemacht,Professionell Aufbereitet. Probefahrt Möglich da Auto noch angemeldet ist,wird nur Abgemeldet Verkauft. Verkauf für Export Bevorzugt wegen Alter und Laufleistung. Auto fährt sehr Gut und Schaltet Sauber. Privat Verkauf Garantie,Gewährleistung sowie Rücknahme Ausgeschlossen. Letzte Preis Anfragen werden nicht Beantwortet.Verhandelt wird nur vor Ort bei Besichtigung. Bei andere Fragen Bitte Schreiben. Anschauen Lohnt sich. Preis Vb 5350 Euro",False,313000,Februar 2008,Diesel,Automatik,2026-06-06T23:39:28.500054
3427631764,BMW E46 320d,1 € VB,53225 Beuel,https://www.kleinanzeigen.de/s-anzeige/bmw-e46-320d/3427631764-216-1055,Reserviert • Gelöscht • BMW E46 320d,1 € VB,1,"Sehr geehrte Damen und Herren, Ich biete meinen bmw e46 320d Limousine an. Motor und Getriebe sind in einem Top Zustand. Kilometer sind original. Das Auto hat leider sehr viele Gebrauchsspuren. Das Auto hat außen bisschen Rost aber alles im rahmen und behebbar. Ich habe das Auto jetzt ca. 1 Jahr. Der vorherige Besitzer teilte mir mit dass das Auto 2 Jahre lang stand und keiner bewegt hat. Untenherum vom Auto ist leider mehr Rost man müsste es am besten weg schleifen lassen und eine Unterbodenschutz Grundierung machen. Beim Bremsen wackelt das Lenkrad auch. Auf dem Dach sind Beulen die müsste man rausbeulen das sieht es wieder gut aus. Das Auto wird jeden Tag zur Arbeit noch bewegt daher können die KM variieren. Tausch würde auch gehen. Bitte nur ernste Interessen.",False,204000,November 2004,Diesel,Manuell,2026-06-06T23:39:33.477981
3427605180,BMW 320d Touring - TÜV NEU 12 Fach Bereift,7.600 €,42279 Oberbarmen,https://www.kleinanzeigen.de/s-anzeige/bmw-320d-touring-tuev-neu-12-fach-bereift/3427605180-216-1567,Reserviert • Gelöscht • BMW 320d Touring - TÜV NEU 12 Fach Bereift,7.600 €,7600,"BMW 320D Touring mit 18 Zoll Räder Inspektion wurde neu durchgeführt - Bremsen Komplett erneuert, Bremssceiben + Brems Klötze Motor und Getriebe ist in einem sehr guten Zustand, Windschutzscheibe wurde erneuert wegen Steinschlag Anhängerkupplung ist auch vorhanden 1 Satz 17 Zoll Orginal Winterräder BMW 1 Satz 18 Zoll Orginal Winterräder BMW 1 Satz 18 Zoll Orginal M Sommerräder BMW Der Wagen hat altersbedingte Gebrauchspuren, kleine Kratzer und Dellen etc Wagen ist noch angemeldet und KM kann sich ändern TÜV NEU bis 6/2028 Für weitere Fragen einfach melden Kombi Gebrauchtfahrzeug Unfallfrei Hubraum: 1995 cm³ Anzahl der Türen: 4/5 Türen Anzahl Sitzplätze: 5 Schadstoffklasse: Euro5 Umweltplakette: 4 (Grün) Anzahl der Fahrzeughalter: 3 HU: 6/2028 Farbe: Schwarz Metallic Farbe (Hersteller): -- Innenausstattung: Stoff Farbe der Innenausstattung: Schwarz Airbags: -- Anhängerkupplung: Anhängerkupplung schwenkbar Radio: Tuner/Radio, Radio DAB Tagfahrlicht (Art): LED-Tagfahrlicht Kurvenlicht (Art): Adaptives Kurvenlicht Ausstattung ABS, Armlehne, Berganfahrassistent, Bluetooth, Bordcomputer, CD-Spieler, Dachreling, ESP, Elektr. Fensterheber, Elektr. Heckklappe, Elektr. Seitenspiegel, Freisprecheinrichtung, Gepäckraumabtrennung, Geschwindigkeitsbegrenzer, Isofix, Lederlenkrad, Leichtmetallfelgen, Lichtsensor, Multifunktionslenkrad, Navigationssystem, Nebelscheinwerfer, Nichtraucher-Fahrzeug, Partikelfilter, Regensensor, Reifendruckkontrolle, Scheinwerferreinigung, Servolenkung, Sitzheizung, Sommerreifen, Start/Stopp-Automatik, Traktionskontrolle, USB, Winterreifen, Xenonscheinwerfer, Zentralverriegelung Der Preis ist Verhandlungsbasis. Privatanbieter 42279 Wuppertal Deutschland Tel.: +49 176 32568699 Inserat bereitgestellt von",False,277000,April 2013,Diesel,Manuell,2026-06-06T23:39:38.663852
3427300349,BMW 320 Gran Turismo 320 d xDrive,15.999 €,42857 Remscheid,https://www.kleinanzeigen.de/s-anzeige/bmw-320-gran-turismo-320-d-xdrive/3427300349-216-1034,Reserviert • Gelöscht • BMW 320 Gran Turismo 320 d xDrive,15.999 €,15999,"BMW 320 Gran Turismo 184 PS Automatikgetriebe - 3.Hand - Original ca 186.000 km gelaufen - Scheckhefrgepflegt - TÜV/AU 4/2027 - Nichtraucherfahrzeug Sonderausstattung: - Alarmanlage - Comfort-Paket - Exterieurumfänge Aluminium satiniert - Geschwindigkeits-Regelanlage mit Bremsfunktion - Innenausstattung: Interieurleisten Aluminium Längsschliff fein - Innovations-Paket - Komfortzugang (Öffnungs- und Schließsystem) - Lenkrad heizbar - Licht- und Regensensor - Metallic-Lackierung - Navigations-Paket ConnectedDrive - Rückfahrkamera - Sicherheitssystem Active Protection - Sitzbezug / Polsterung: Leder Dakota - Sonnenschutzverglasung (hinten abgedunkelt) - Sport-Paket M / M-Technic - Surround-Kamerasystem (Surround View) Serien-Ausstattung: - Airbag Beifahrerseite abschaltbar - Airbag Fahrer-/Beifahrerseite - Aktive Motorhaube - Aktiver Heckspoiler (elektrisch ausfahrbar) - Anti-Blockier-System (ABS) - Antriebsart: xDrive (Allrad) - Auspuffanlage (1-Rohr-Anlage) mit Blende - AUX-IN-Anschluss (AUX-IN) - Außenspiegel elektr. verstell- und heizbar - Außenspiegel Wagenfarbe - Blinkleuchten LED - Bordcomputer - Bremsassistent - Bremsenergierückgewinnung (Rekuperationssystem) - Check-Control-System - Drehzahlmesser - Durchladeeinrichtung (Mittelarmlehne hinten) - Dynamische Bremsleuchte - Dynamische Stabilitäts-Control (DSC) - Fahrassistenz-System: Fahrerlebnisschalter - Farbmonitor (6,5 Zoll) - Fensterheber elektrisch vorn + hinten - Freisprecheinrichtung Bluetooth mit USB-/Audio-Schnittstelle - Fußmatten Velours - Gepäckraumabdeckung / Rollo - Getriebe Automatik - (8-Stufen) - Heckklappenbetätigung automatisch - Heckleuchten LED - Isofix-Aufnahmen für Kindersitz an Rücksitz - Karosserie: 5-türig - Kopf-Airbag-System hinten - Kopf-Airbag-System vorn - Kopfstützen hinten klappbar - Lenksäule (Lenkrad) mechan. verstellbar - LM-Felgen - Motor 2,0 Ltr. - 135 kW Turbodiesel - Nebelscheinwerfer - Nichtraucher-Paket - Reifendruck-Kontrollsystem - Reifenpannen-Anzeige - Rußpartikelfilter - Schadstoffarm nach Abgasnorm Euro 6 - Schaltpunktanzeige - Scheibenwaschdüsen heizbar - Seitenairbag hinten - Seitenairbag vorn - Service-System: Intelligenter Notruf inkl. TeleServices - Servolenkung Servotronic - Sitze vorn höhenverstellbar - Start-Stop-Knopf - Start/Stop-Anlage (Funktion) - Stoßfänger Wagenfarbe - Wegfahrsperre - Zentralverriegelung mit Fernbedienung Unser Service: Finanzierung auch ohne Anzahlung möglich Gebrauchtwagengarantie 12-36 Monate möglich Wir nehmen ihr Fahrzeug gern Inzahlung 5 Tages Kurzkennzeichen organisierbar Öffnungszeiten: Mo.-Fr. : 10:00-18:00 Uhr Samstag: 10:00-14:00 Uhr Besichtigungstermine bitte vorher telefonisch vereinbaren ! Alle Angaben ohne Gewähr! Irrtümer, Änderungen und Zwischenverkauf vorbehalten. Limousine Gebrauchtfahrzeug Unfallfrei Hubraum: 1995 cm³ Anzahl der Türen: 4/5 Türen Anzahl Sitzplätze: 5 Schadstoffklasse: Euro6 Umweltplakette: -- Anzahl der Fahrzeughalter: -- HU: 4/2027 Farbe: Grau Metallic Farbe (Hersteller): MINERALGRAU METALLIC Innenausstattung: Andere Farbe der Innenausstattung: -- Airbags: -- Anhängerkupplung: -- Radio: Tuner/Radio Tagfahrlicht (Art): LED-Tagfahrlicht Ausstattung ABS, Abgedunkelte Scheiben, Alarmanlage, Allradantrieb, Ambiente-Beleuchtung, Armlehne, Beheizbares Lenkrad, Bordcomputer, ESP, Elektr. Fensterheber, Elektr. Heckklappe, Elektr. Seitenspiegel, Elektr. Wegfahrsperre, Freisprecheinrichtung, Isofix, Lederlenkrad, Leichtmetallfelgen, Multifunktionslenkrad, Navigationssystem, Nebelscheinwerfer, Nichtraucher-Fahrzeug, Notrufsystem, Partikelfilter, Regensensor, Reifendruckkontrolle, Scheinwerferreinigung, Schlüssellose Zentralverriegelung (Keyless), Servolenkung, Sitzheizung, Skisack, Sportpaket, Start/Stopp-Automatik, Traktionskontrolle, USB, Zentralverriegelung Inserat bereitgestellt von",False,186000,November 2014,Diesel,Automatik,2026-06-06T23:39:43.955048
