listing_id,search_title,search_price_text,location,url,title,price_text,price,description,is_active,mileage_km,first_registration,fuel,transmission,scraped_at
3428135042,BMW 320 d Limousine,19.900 €,45701 Herten,https://www.kleinanzeigen.de/s-anzeige/bmw-320-d-limousine/3428135042-216-1831,Reserviert • Gelöscht • BMW 320 d Limousine,19.900 €,19900,Verkaufe mein Auto Baujahr Dezember 2016 BMW 320 i M Sportpacket Performance Klimaautomatik Keyless Kurvenlicht Alcantara Sitze Elektrische Sitzwangen verstellung Lenkradheizung Harman/kardon Tansanit Blau 1.Hand Privat Verkauf keine Rücknahme keine Garantie,False,112000,Dezember 2016,Diesel,Manuell,2026-06-06T23:37:16.293940
3428130739,Auto BMW 320d,5.100 €,42277 Oberbarmen,https://www.kleinanzeigen.de/s-anzeige/auto-bmw-320d/3428130739-216-1566,Reserviert • Gelöscht • Auto BMW 320d,5.100 €,5100,"Sehr gutes Auto, Motor und Getriebe funktionieren einwandfrei, neue Reifen. Neue TÜV",False,220877,Februar 2011,Diesel,Manuell,2026-06-06T23:37:21.578790
3428120956,BMW 320d E93 Cabrio Facelift,13.800 € VB,50389 Wesseling,https://www.kleinanzeigen.de/s-anzeige/bmw-320d-e93-cabrio-facelift/3428120956-216-1391,Reserviert • Gelöscht • BMW 320d E93 Cabrio Facelift,13.800 € VB,13800,"Hiermit verkaufe ich mein Auto den ich vor ein Monat angelegt habe aber gemerkt habe dass Cabrio nichts für mich ist deswegen will ich auf etwas anderes umsteigen. Keine Garantie Keine Rücknahme Privat Verkauf. Auto noch angemeldet kann Probe gefahren werden, wird aber abgemeldet abgegeben.",False,180495,März 2012,Diesel,Automatik,2026-06-06T23:37:26.835346
3428118679,BMW 320d F31 (motorproblem),6.000 € VB,45277 Essen-​Ruhrhalbinsel,https://www.kleinanzeigen.de/s-anzeige/bmw-320d-f31-motorproblem-/3428118679-216-2041,Reserviert • Gelöscht • BMW 320d F31 (motorproblem),6.000 € VB,6000,"Hallo Zu verkaufen BMW f31 mit Motorproblem (zweiter Zylinder hat ganz niedrige Kompression, motortausch oder generell Überholung) In meine Händen seit 5/6 Jahren , ölinspektion je 10-15k km durchgeführt. Bei Interesse einfach per pn melden",False,250000,April 2014,Diesel,Automatik,2026-06-06T23:37:32.321392
3428094039,BMW 320D E46 EXPORT,1.000 €,53359 Rheinbach,https://www.kleinanzeigen.de/s-anzeige/bmw-320d-e46-export/3428094039-216-1668,Reserviert • Gelöscht • BMW 320D E46 EXPORT,1.000 €,1000,"Guten Tag, hiermit verkaufe ich meinen 320d Compact. Habe ihn damals gekauft, weil ich einen Daily für die Arbeit brauchte. Leider ist der Turbolader defekt und wird nun als Teilespender verkauft. Das Auto hat mal einen Austausch Motor bekommen. Ob das stimmt, weiß ich nicht. Fahrzeug ist ERSTE HAND!! Für Export!! Zur Ausstattung: M-Paket Alcantara ohne Risse Multifunkionslenkrad (Spange wurde gegen eins ohne MFL getauscht) Tempomat Tieferlegung Alarmanlage Fahrzeug hat keine Bremse mehr!! Der Verkauf erfolgt unter Ausschluss jeglicher Sachmängelhaftung!",False,400,Januar 2003,Diesel,Manuell,2026-06-06T23:37:37.706675
3428088847,BMW 320d EfficientD. Ed. Touring Luxury Line Lux...,19.850 €,40599 Benrath,https://www.kleinanzeigen.de/s-anzeige/bmw-320d-efficientd-ed-touring-luxury-line-lux-/3428088847-216-2074,Reserviert • Gelöscht • BMW 320d EfficientD. Ed. Touring Luxury Line Lux...,19.850 €,19850,"Zum Verkauf steht mein BMW aus Privatbesitz. Ausstattung / vorhanden: H&R Spurplatten vorne und hinten Winterradsatz original BMW 17 Zoll Sommerradsatz BMW 18 Zoll TÜV bis 03/2027 Letzter Ölwechsel am 13.03.2025 bei 60.172 km Zustand: Optisch gepflegter Zustand Gebrauchsspuren dem Alter entsprechend vorhanden Stoßfänger vorne mit Kratzer Stoßfänger hinten mit Kratzer Sommerfelge vorne rechts verkratzt Hinweise: Fahrzeug ist noch angemeldet Wird regelmäßig bewegt Der Kilometerstand kann sich daher noch geringfügig ändern Verkauf erfolgt von privat unter Ausschluss von Garantie, Gewährleistung und Rücknahme. Bei Interesse gerne melden. Kombi Gebrauchtfahrzeug Unfallfrei Hubraum: 1995 cm³ Anzahl der Türen: 4/5 Türen Anzahl Sitzplätze: 5 Schadstoffklasse: Euro6c Umweltplakette: 4 (Grün) Anzahl der Fahrzeughalter: 3 HU: 3/2027 Farbe: Braun Metallic Farbe (Hersteller): -- Innenausstattung: Vollleder Farbe der Innenausstattung: Beige Airbags: Front-, Seiten- und weitere Airbags Anhängerkupplung: -- Radio: Tuner/Radio Tagfahrlicht (Art): LED-Tagfahrlicht Kurvenlicht (Art): Adaptives Kurvenlicht Ausstattung ABS, Abstandswarner, Alarmanlage, Ambiente-Beleuchtung, Apple CarPlay, Armlehne, Beheizbares Lenkrad, Berganfahrassistent, Bluetooth, Bordcomputer, CD-Spieler, Dachreling, ESP, Elektr. Fensterheber, Elektr. Heckklappe, Elektr. Seitenspiegel, Elektr. Sitzeinstellung, Elektr. Wegfahrsperre, Fernlichtassistent, Freisprecheinrichtung, Gepäckraumabtrennung, Geschwindigkeitsbegrenzer, Head-Up Display, Induktionsladen für Smartphones, Innenspiegel autom. abblendend, Isofix, Lederausstattung, Lederlenkrad, Leichtmetallfelgen, Lichtsensor, Lordosenstütze, Multifunktionslenkrad, Navigationssystem, Nebelscheinwerfer, Nichtraucher-Fahrzeug, Notrufsystem, Partikelfilter, Regensensor, Reifendruckkontrolle, Schaltwippen, Schiebedach, Schlüssellose Zentralverriegelung (Keyless), Servolenkung, Sitzheizung, Sitzheizung hinten, Sommerreifen, Soundsystem, Sportsitze, Sprachsteuerung, Start/Stopp-Automatik, Touchscreen, Traktionskontrolle, USB, Verkehrszeichenerkennung, Volldigitales Kombiinstrument, Winterreifen, Zentralverriegelung Der Preis ist Verhandlungsbasis. Privatanbieter 40599 Düsseldorf Deutschland Inserat bereitgestellt von",False,68150,August 2017,Diesel,Automatik,2026-06-06T23:37:43.221852
3428082296,BMW e92 320d ‼️Tüv neu Automatik,7.700 € VB,52477 Alsdorf,https://www.kleinanzeigen.de/s-anzeige/bmw-e92-320d-tuev-neu-automatik/3428082296-216-1714,Reserviert • Gelöscht • BMW e92 320d ‼️Tüv neu Automatik,7.700 € VB,7700,"Ich habe den Wagen schon seit länger als einem Jahr. Der Wagen ist in ein sehr guten Zustand was Motor und Getriebe angeht mit voller Leistung. Das Auto wurde immer gepflegt und warm gefahren. Es ist technisch auch in einem sehr guten Zustand. -Der ganze Querlenker Set habe ich austauschen lassen -Achsenvermessung -Schleifring neu -sowie Öl und Filter vor kurzem gemacht -vorne neue M Stoßstange drauf -Tüv Neu -BMW Felgen hinten 255/40/17 Es wurde mehr als 1500€ rein gesteckt Mängel: Kotflügel nachlackiert Motorkontrolleuchte (Sensor) geht manchmal an und aus ohne jegliche Beeinträchtigung (Aktuell ist nicht an) Besonderheiten: Sogenannte key less Go auf Knopf und key less auto öffnen. Park-Distance-Control (PDC) hinten Optisch sehr sportlich mit m spiegelkappen, Spoiler und schwarz lackierte Felgen Wer ein schönes sparsames sportliches Auto sucht mit frischen tüv bis 2028‼️ E92 Coupé 2010 130 kWh Automatik Diesel Vollledersitze 3ter Besitzer Normale Gebrauchsspuren vorhanden, wie leichte Kratzer am Kotflügel Ohne jegliche Gewährleistung oder Garantie, daher Privatverkauf",False,257850,April 2010,Diesel,Automatik,2026-06-06T23:37:49.589009
3427999820,Bmw e46 320d,1.500 € VB,32805 Horn-​Bad Meinberg,https://www.kleinanzeigen.de/s-anzeige/bmw-e46-320d/3427999820-216-1262,Reserviert • Gelöscht • Bmw e46 320d,1.500 € VB,1500,Hiermit wird für ein Bekannten das Fahrzeug verkauft Motor und Getriebe läuft Anlasser defekt Bremsen wurde vor kurzem genacht Stoßdämpfer wurde vor kurzem gemacht Alufelgen 17 Zoll gut bereift Xenon Klima Anlage,False,189000,Juni 1999,Diesel,Manuell,2026-06-06T23:37:54.633957
3427930705,"BMW e93 320d M 313 19"" lci",11.600 €,58739 Wickede (Ruhr),https://www.kleinanzeigen.de/s-anzeige/bmw-e93-320d-m-313-19-lci/3427930705-216-1448,"Reserviert • Gelöscht • BMW e93 320d M 313 19"" lci",11.600 €,11600,"Verkauft wird hiermit mein e93 320d mit sehr guter Ausstattung, welcher bis September 2027 noch tüv hat und auch eine frische Inspektion bekommen hat. Es wurde eine sportliche tieferlegung verbaut mit neuen Stoßdämpfern. 2 Schlüssel keyless go/ entry Anzahl der Vorbesitzer liegt bei 8. Die Bremsen und Reifen sind im Guten Zustand , somit muss nichts investiert werden. Sonderausstattung: Bild 19 8- Fach bereift mit 17"" M Winter Felgen Nicht unfallfrei Privatverkauf: Der Verkauf erfolgt unter Ausschluss jeglicher Gewährleistung, Garantie und Rücknahme (§ 437 BGB). Der Artikel wird wie gesehen und unter Ausschluss der Sachmängelhaftung verkauft. Irrtümer und Zwischenverkauf vorbehalten.",False,177000,Mai 2010,Diesel,Automatik,2026-06-06T23:37:59.756799
3427915663,BMW 320d Cabrio -,10.500 €,44379 Lütgendortmund,https://www.kleinanzeigen.de/s-anzeige/bmw-320d-cabrio-/3427915663-216-19681,Reserviert • Gelöscht • BMW 320d Cabrio -,10.500 €,10500,"Hallo, zum Verkauf steht mein gepflegter BMW E93 Cabrio LCI aus dem Jahr 2013 mit Automatikgetriebe und M-Paket. Der Motor läuft einwandfrei, das Getriebe schaltet sauber und es sind keine Warnleuchten aktiv. Eine Probefahrt ist selbstverständlich möglich. TÜV Neu bis Juni 2028 Fahrzeugdaten * Erstzulassung: 2013 * BMW E93 LCI Cabrio * Automatikgetriebe * Diesel * 202.xxx km * M-Paket * Tempomat * Großes Navigationssystem * PDC (Einparkhilfe) vorne und hinten * Sitzheizung * Getränkehalter * Standlüftung Ausstattung & Umbauten * 19-Zoll-Felgen mit Allwetterreifen und gutem Profil * LED-Scheinwerfer-Umbau (eintragungsfrei, TÜV-konform) * Schwarze Nieren (originale Chrom-Nieren vorhanden) * Carbon-Spiegelkappen und Carbon-Türgriffe (Originalteile vorhanden) * Rote Bremssättel * M3-Seitenschweller * Heckspoilerlippe * Ambientebeleuchtung im Fußraum mit verschiedenen Farben * Nachgerüstete Alarmanlage * Heckscheibe und hintere Seitenscheiben foliert Verdeck * Elektrisches Cabrioverdeck funktioniert einwandfrei * Öffnen per Funkschlüssel möglich * Bedienung auch während der Fahrt bis ca. 30 km/h Wartungen & Service * Ölwechsel vor 8.000km * Getriebeölwechsel durchgeführt (Rechnung 300€ vorhanden) * Injektoren gereinigt und generalüberholt (Rechnung über 840 € vorhanden). * Checkheftgepfegt Sonstiges Das Fahrzeug wurde stets gepflegt und bereitet besonders im Sommer viel Fahrspaß. Das Verdeck arbeitet problemlos und die Sitze befinden sich in einem guten Zustand. Bei Interesse oder Fragen einfach melden. Besichtigung und Probefahrt nach Absprache möglich. Cabrio/Roadster Gebrauchtfahrzeug Hubraum: 1995 cm³ Anzahl der Türen: 2/3 Türen Anzahl Sitzplätze: 4 Schadstoffklasse: Euro4 Umweltplakette: -- Anzahl der Fahrzeughalter: -- HU: 6/2028 Farbe: Schwarz Metallic Farbe (Hersteller): -- Innenausstattung: Vollleder Farbe der Innenausstattung: -- Airbags: -- Anhängerkupplung: -- Radio: Radio DAB Tagfahrlicht (Art): LED-Tagfahrlicht Ausstattung ABS, Alarmanlage, Allwetterreifen, Ambiente-Beleuchtung, Armlehne, Bluetooth, Bordcomputer, CD-Spieler, ESP, Elektr. Fensterheber, Elektr. Sitzeinstellung, Freisprecheinrichtung, Gepäckraumabtrennung, Isofix, Lederausstattung, Lederlenkrad, Leichtmetallfelgen, Multifunktionslenkrad, Navigationssystem, Nebelscheinwerfer, Partikelfilter, Reifendruckkontrolle, Scheckheftgepflegt, Scheinwerferreinigung, Servolenkung, Sitzheizung, Soundsystem, Sportpaket, Traktionskontrolle, USB, Zentralverriegelung Der Preis ist Verhandlungsbasis. Privatanbieter 44379 Dortmund Deutschland Tel.: +49 173 5840742 Inserat bereitgestellt von",False,202000,Februar 2013,Diesel,Automatik,2026-06-06T23:38:04.772223
3411349079,"BMW 320d (f31) mit Head-up-Display, Leder, Winterräder, Navi etc.",9.000 €,52080 Eilendorf,https://www.kleinanzeigen.de/s-anzeige/bmw-320d-f31-mit-head-up-display-leder-winterraeder-navi-etc-/3411349079-216-1931,"Reserviert • Gelöscht • BMW 320d (f31) mit Head-up-Display, Leder, Winterräder, Navi etc.",9.000 €,9000,"BMW 3er Touring (F31) — Baujahr 2013 Verkaufe gepflegten BMW 3er Touring (F31) aus März 2013. Langstreckenfahrzeug, regelmäßig gewartet — alle Rechnungen und TÜV-Berichte vorhanden. Ausstattung (Auszug) Winterräder auf BMW 16 Zoll Felgen Sommerräder 18 Zoll original M-Felgen ohne Kratzer Ledersitze Navigationssystem Head-up-Display Sitzheizung Adaptives Kurvenlicht Klimaanlage / Automatik Elektrische Fensterheber & Spiegel Multifunktionslenkrad Zentralverriegelung mit Fernbedienung … Nichtraucherfahrzeug Ölwechsel vor 1000 km gemacht. Reifen und Bremsen: (Reifen ca. 60%“, „Bremsen kürzlich erneuert“ — alle Beläge und hintere Scheiben neu). Die nächsten 29000 km muss nichts an dem Auto gemacht werden. Falls erwünscht, kann ein Gebrauchtwagen Check vor dem Kauf auf eigene Kosten durchgeführt werden. Das Fahrzeug wurde überwiegend für Langstrecken verwendet, da ein kleineres Auto vorhanden ist. Mit einer Tankfüllung sind 1150 km bei moderater Fahrweise mögliche, was ich bei einem Urlaub vor kurzer Zeit noch festgestellt habe. Das Auto hat nie Probleme bereitet und wurde immer gut gepflegt. Es ist noch angemeldet und wird noch gefahren, bis es verkauft wird. Bitte keine Anfragen wie „ich tausche gegen …“ oder „ich hole das Auto für 7000 Euro ab“. Hinweis: Alle Angaben nach bestem Wissen; Irrtümer und Zwischenverkauf vorbehalten.",False,188000,März 2013,Diesel,Manuell,2026-06-06T23:38:11.348538
3427867189,Bmw e91 320d,3.999 € VB,32805 Horn-​Bad Meinberg,https://www.kleinanzeigen.de/s-anzeige/bmw-e91-320d/3427867189-216-1262,Reserviert • Gelöscht • Bmw e91 320d,3.999 € VB,3999,"Ich verkaufe mein gepflegtes und zuverlässiges Auto aufgrund einer Neuanschaffung. Das Fahrzeug wurde überwiegend auf Langstrecken gefahren und überzeugt durch seinen geringen Kraftstoffverbrauch. Motor und Getriebe befinden sich in einem sehr guten Zustand, das Auto läuft einwandfrei. Ausstattung & Zustand: * Kein Rost * 8-fach bereift (Sommer- und Winterreifen) * Frischer Ölwechsel * Bremsen und Bremsbeläge rundum erneuert * Sparsamer Verbrauch * Technisch in gutem Zustand Der TÜV ist aktuell abgelaufen bzw. muss erneuert werden. Nach meinem Kenntnisstand sollte das Fahrzeug die Hauptuntersuchung ohne Probleme bestehen. Bei Interesse oder Fragen gerne melden. Besichtigung und Probefahrt nach Absprache möglich",False,344000,Juni 2009,Diesel,Manuell,2026-06-06T23:38:17.057358
3427799763,BMW 320d e90 Turboschaden,5.000 €,47055 Duisburg-​Mitte,https://www.kleinanzeigen.de/s-anzeige/bmw-320d-e90-turboschaden/3427799763-216-2147,Reserviert • Gelöscht • BMW 320d e90 Turboschaden,5.000 €,5000,Hier mit verkaufe ich mein geliebten 3er BMW mit turboschaden. Getriebe und der Motor laufen sehr ruhig nur hab ich keine Zeit mehr den Turbo auszutauschen da ich mir einen Benziner kaufen möchte. Das Auto hat CarPlay und 19zoll Felgen auf Sommerreifen. Keine Gewährleistung und Garantie auf dieses Auto. Das Auto muss abgeschleppt werden.,False,307000,September 2008,Diesel,Manuell,2026-06-06T23:38:22.822999
3427762412,BMW E93 Cabrio LCI 320d M Paket | Automatik | TÜV Neu | 19 Zoll,10.500 €,44379 Lütgendortmund,https://www.kleinanzeigen.de/s-anzeige/bmw-e93-cabrio-lci-320d-m-paket-automatik-tuev-neu-19-zoll/3427762412-216-19681,Reserviert • Gelöscht • BMW E93 Cabrio LCI 320d M Paket | Automatik | TÜV Neu | 19 Zoll,10.500 €,10500,BMW E93 320d Cabrio LCI mit M-Paket aus 2013 zu verkaufen. Das Fahrzeug befindet sich in einem gepflegten Zustand und ist Checkheftgepflegt. Motor und Automatikgetriebe laufen einwandfrei. Keine Warnleuchten aktiv. Probefahrt und Besichtigung sind nach Absprache möglich. ✅ TÜV neu bis 06/2028 Ausstattung: * M-Paket * Automatik * Großes Navigationssystem * Tempomat * PDC vorne und hinten * Sitzheizung * Standlüftung * Getränkehalter Umbauten: * 19-Zoll-Felgen mit Allwetterreifen * LED-Scheinwerfer Eintragungsfrei * Schwarze Nieren * Carbon-Spiegelkappen und Carbon-Türgriffe * Rote Bremssättel * M3-Seitenschweller * Heckspoilerlippe * Ambientebeleuchtung im Fußraum * Nachgerüstete Alarmanlage * Heckscheibe und hintere Seitenscheiben foliert Verdeck: * Funktioniert einwandfrei * Öffnung per Funkschlüssel * Bedienung während der Fahrt bis ca. 30 km/h Wartungen: * Ölwechsel vor 8.000 km * Getriebeölwechsel durchgeführt * Injektoren generalüberholt (Rechnungen vorhanden) * Checkheft vorhanden Bei ernsthaftem Interesse gerne melden.,False,202000,März 2013,Diesel,Automatik,2026-06-06T23:38:28.585597
3427759198,BMW 320d xDrive -,4.499 €,51375 Leverkusen,https://www.kleinanzeigen.de/s-anzeige/bmw-320d-xdrive-/3427759198-216-1995,Reserviert • Gelöscht • BMW 320d xDrive -,4.499 €,4499,"Hiermit Verkaufe ich meine Auto Sehr viele neue Teile, Auto is Top, Motor und Getriebe perfekt, Auto hat kein Oil oder Waser Verlust, Service neu gemacht Neue Brems Scheibe und Belge Hinterachse und Vordereachse Neu Und viele andere Teile. Limousine Gebrauchtfahrzeug Unfallfrei Hubraum: 1995 cm³ Anzahl der Türen: 4/5 Türen Anzahl Sitzplätze: 5 Schadstoffklasse: Euro5 Umweltplakette: 4 (Grün) Anzahl der Fahrzeughalter: 3 HU: -- Farbe: Schwarz Metallic Farbe (Hersteller): -- Innenausstattung: Stoff Farbe der Innenausstattung: Schwarz Airbags: -- Anhängerkupplung: -- Radio: Tuner/Radio, Radio DAB Tagfahrlicht (Art): LED-Tagfahrlicht Kurvenlicht (Art): Kurvenlicht Ausstattung ABS, Allwetterreifen, Armlehne, Berganfahrassistent, Blendfreies Fernlicht, Bordcomputer, CD-Spieler, ESP, Elektr. Fensterheber, Elektr. Seitenspiegel, Elektr. Wegfahrsperre, Fernlichtassistent, Isofix, Lederlenkrad, Leichtmetallfelgen, Lichtsensor, Lordosenstütze, Multifunktionslenkrad, Müdigkeitswarner, Nebelscheinwerfer, Partikelfilter, Raucherpaket, Regensensor, Reifendruckkontrolle, Scheinwerferreinigung, Schlüssellose Zentralverriegelung (Keyless), Servolenkung, Sitzheizung, Start/Stopp-Automatik, Traktionskontrolle, Xenonscheinwerfer, Zentralverriegelung Der Preis ist Verhandlungsbasis. Privatanbieter 51375 Leverkusen Deutschland Tel.: +49 172 6207474 Inserat bereitgestellt von",False,198000,Juli 2009,Diesel,Manuell,2026-06-06T23:38:35.273178
3427739313,BMW 320d Touring,28.500 € VB,32289 Rödinghausen,https://www.kleinanzeigen.de/s-anzeige/bmw-320d-touring/3427739313-216-1603,Reserviert • Gelöscht • BMW 320d Touring,28.500 € VB,28500,"Zum Verkauf steht mein geliebter BMW 320d Touring. Das Fahrzeug befindet sich in einem guten und gepflegten Zustand und wurde regelmäßig gewartet. Alle Inspektionen wurden entsprechend durchgeführt, das Fahrzeug ist scheckheftgepflegt. Der BMW überzeugt durch seinen sparsamen und gleichzeitig leistungsstarken Dieselmotor. Fahrzeugdaten: BMW 320d Touring Erstzulassung: 12/2019 Kilometerstand: 100.000 km (wird derzeit noch gefahren) Diesel TÜV bis 03/2027 Scheckheftgepflegt Guter Allgemeinzustand Sofort fahrbereit NEUE Allwetterreifen Winterreifen (1 Saison gefahren) 250€ BMW-Gutschein für die nächste Inspektion (siehe letztes Bild) Das Fahrzeug verfügt über die serienmäßige Ausstattung und bietet den für BMW typischen Fahrspaß sowie eine hochwertige Verarbeitung. Der Verkauf erfolgt lediglich aufgrund eines bevorstehenden Firmenwagens. Es besteht kein technischer Notverkauf. Besichtigung und Probefahrt sind nach Absprache jederzeit möglich. Bei Interesse oder Fragen freue ich mich über eine Nachricht. Privatverkauf, daher keine Garantie, Gewährleistung oder Rücknahme.",False,100000,November 2019,Diesel,Automatik,2026-06-06T23:38:40.650181
3427363151,BMW 320 d Touring Sport Line* Shadow Line*,21.990 €,52477 Alsdorf,https://www.kleinanzeigen.de/s-anzeige/bmw-320-d-touring-sport-line-shadow-line-/3427363151-216-1714,Reserviert • Gelöscht • BMW 320 d Touring Sport Line* Shadow Line*,21.990 €,21990,"BMW 320d Sport Line – EZ 06/2022 Moderner und sportlich ausgestatteter 3er mit umfangreichen Assistenzsystemen und lückenlos dokumentierter Servicehistorie. Komfortabel, effizient und bestens ausgestattet für Alltag und Langstrecke. Fahrzeugdaten ✅ Erstzulassung: 06/2022 ✅ Laufleistung: 142.846 km ✅ Halter: 2. Hand ✅ Getriebe: Automatik ✅ Scheckheft: gepflegt ✅ Letzter Service bei 124.446 km ✅ TÜV: 04/2027 Servicehistorie: Service bei 6 km Service bei 24.941 km Service bei 50.780 km Service bei 76.582 km Service bei 100.954 km Service bei 124.446 km Ausstattung & Highlights ✅ Sport Line ✅ Fahrassistenz-System: Active Guard (Bremsassistent) ✅ Active Guard Plus (Spurhalteassistent, Frontkollisionswarnung) ✅ Auffahrwarnsystem mit Bremsfunktion ✅ Aufmerksamkeits-Assistent ✅ Driving Assistant ✅ Fahrerlebnisschalter ✅ Fernlichtassistent ✅ Heckaufprall-Vermeidung ✅ Park-Assistent ✅ Querverkehrs-Assistent ✅ Rückfahr-Assistent ✅ Speed-Limit-Anzeige ✅ Spurwechsel-Warnsystem ✅ Aktiver Spurhalteassistent ✅ Frontscheibe Akustikglas ✅ Anhängerkupplung (Kugelkopf schwenkbar) ✅ Heckklappenbetätigung automatisch ✅ Rückfahrkamera Unsere Leistungen ✅ 1 Jahr Gewährleistung – Sie sind im ersten Jahr nach Kauf gegen technische Mängel abgesichert ✅ Finanzierung möglich – auch ohne Anzahlung ✅ Bundesweite Lieferung möglich ✅ Besichtigung & Probefahrt nach Absprache Änderungen / Irrtümer / Zwischenverkauf sind vorbehalten. - Anmeldeservice möglich! - Bundesweite Anlieferung möglich! Unsere Fahrzeuge werden für den Wiederverkauf professionell aufbereitet und in unserer Werkstatt auf Sicherheit und Zustand geprüft. - Finanzierung auch ohne Anzahlung möglich! - Inzahlungnahme möglich! Sonderausstattung: BMW Live Cockpit ConnectedDrive, Fahrassistenz-System: Driving Assistant, Fahrassistenz-System: Fernlichtassistent, HiFi-Lautsprechersystem, LM-Felgen 7,5x18 (V-Speiche 780, Bicolor), Metallic-Lackierung, Parkassistent-Paket, Sitzheizung vorn, Spiegel-Paket, Verglasung Akustikglas Weitere Ausstattung: Ablage-Paket, Airbag Beifahrerseite abschaltbar, Airbag Fahrer-/Beifahrerseite, Aktive Motorhaube, Ambiente-Beleuchtung, Auspuffanlage (2-Rohr-Anlage) mit Chromblenden, Außenausstattung: Shadow-Line Hochglanz, Außenspiegel elektr. verstell- und heizbar, Befestigungssystem im Kofferraum, Bordcomputer, Bremsassistent, DAB-Tuner (Radioempfang digital), Dachreling Hochglanz Shadow-Line, Diebstahlsicherung für Räder (Felgenschlösser), Durchladeeinrichtung (Mittelarmlehne hinten), Dynamische Bremsleuchte, Dynamische Tractions Control (DTC), Erste Hilfe-Kasten / Verbandkasten, Fahrassistenz-System: Active Guard (Bremsassistent), Fahrassistenz-System: Active Guard Plus (Spurhalteassistent, Frontkollisionswarnung), Fahrassistenz-System: Aufmerksamkeits-Assistent, Fahrassistenz-System: Fahrerlebnisschalter, Freisprecheinrichtung mit USB-Schnittstelle, Frontscheibe Akustikglas, Fußmatten Velours, Gepäckraum-Abtrennung (Netz), Heckklappenbetätigung automatisch, Heckleuchten LED, Innenausstattung: Interieurleisten, schwarz hochglänzend, Innenspiegel mit Abblendautomatik, Isofix-Aufnahmen für Kindersitz an Rücksitz, Karosserie: 5-türig, Klimaautomatik 3-Zonen mit autom. Umluft-Control, Kopf-Airbag-System hinten, Kopf-Airbag-System vorn, Kopfstützen hinten klappbar, Lenkrad (Sport/Leder) mit Multifunktion, Mild-Hybrid 140 kW (Motor 2,0 Ltr. - 140 kW Diesel), Mittelarmlehne hinten, Park-Distance-Control (PDC) vorn und hinten, Parkbremse elektrisch, Personalisierungssystem (Personal Profile), Reifendruck-Kontrollsystem, Rücksitzlehne geteilt/klappbar (40:20:40), Schadstoffarm nach Abgasnorm Euro 6d, Scheinwerfer LED, Seitenairbag vorn, Service-System: ConnectedDrive Services, Service-System: Gesetzlicher Notruf, Service-System: Intelligenter Notruf inkl. TeleServices, Sitzbezug / Polsterung: Stoff Sensatec, Sport Line, Sportsitze vorn, Start-Stop-Knopf, Start/Stop-Anlage (Funktion), Warndreieck Das AUTOCENTER in HOENGEN begrüßt sie gerne zu einer unverbindlichen Probefahrt oder Besichtigung. Eine Inzahlungnahme ihres derzeitigen Fahrzeuges ist möglich. Ständig neue und gepflegte Fahrzeuge im Sortiment. We speak English - Contact us by phone - WhatsApp Unsere Öffnungszeiten: Montag-Freitag : 10.00 Uhr - 18.00 Uhr Samstag : 10.00 Uhr - 16.00 Uhr Wir freuen uns auf ihren Besuch ! Kombi Gebrauchtfahrzeug Hubraum: 1995 cm³ Anzahl der Türen: 4/5 Türen Anzahl Sitzplätze: 5 Schadstoffklasse: Euro6 Umweltplakette: 4 (Grün) Anzahl der Fahrzeughalter: 2 HU: Neu Farbe: Schwarz Metallic Farbe (Hersteller): SAPHIRSCHWARZ Innenausstattung: -- Farbe der Innenausstattung: -- Airbags: Front-, Seiten- und weitere Airbags Anhängerkupplung: Anhängerkupplung schwenkbar Radio: Tuner/Radio, Radio DAB Tagfahrlicht (Art): LED-Tagfahrlicht Kurvenlicht (Art): Adaptives Kurvenlicht Pannenhilfe: Pannenkit Ausstattung ABS, Abstandswarner, Ambiente-Beleuchtung, Android Auto, Apple CarPlay, Armlehne, Berganfahrassistent, Blendfreies Fernlicht, Bluetooth, Bordcomputer, Dachreling, ESP, Elektr. Fensterheber, Elektr. Heckklappe, Elektr. Seitenspiegel, Elektr. Seitenspiegel anklappbar, Elektr. Wegfahrsperre, Fernlichtassistent, Freisprecheinrichtung, Garantie, Innenspiegel autom. abblendend, Inspektion neu, Isofix, Lederlenkrad, Leichtmetallfelgen, Lichtsensor, Lordosenstütze, Multifunktionslenkrad, Musikstreaming integriert, Müdigkeitswarner, Navigationssystem, Nebelscheinwerfer, Nichtraucher-Fahrzeug, Notbremsassistent, Notrufsystem, Partikelfilter, Regensensor, Reifendruckkontrolle, Schaltwippen, Scheckheftgepflegt, Scheinwerferreinigung, Servolenkung, Sitzheizung, Sommerreifen, Soundsystem, Sportpaket, Sportsitze, Sprachsteuerung, Spurhalteassistent, Start/Stopp-Automatik, Totwinkel-Assistent, Touchscreen, Traktionskontrolle, USB, Verkehrszeichenerkennung, Volldigitales Kombiinstrument, Zentralverriegelung Inserat bereitgestellt von",False,142846,Juni 2022,Diesel,Automatik,2026-06-06T23:38:46.077773
