listing_id,search_title,search_price_text,location,url,title,price_text,price,description,is_active,mileage_km,first_registration,fuel,transmission,scraped_at
3427036656,BMW 320d Touring motorproblem dreht startet nicht,3.900 €,42285 Barmen,https://www.kleinanzeigen.de/s-anzeige/bmw-320d-touring-motorproblem-dreht-startet-nicht/3427036656-216-1572,Reserviert • Gelöscht • BMW 320d Touring motorproblem dreht startet nicht,3.900 €,3900,"Motorproblem dreht startet nicht. 2xSchlüssel Euro5 2Hand +49 162 3103003 Mails werden nicht beantwortet. -Festpreis- Bilder / Live Video Per Whatsapp WhatsApp : +49 162 3103003 Montag bis Freitag 09:00Uhr-17:30Uhr Samstag 10:00Uhr bis 16Uhr Sonntag Geschlossen Adresse: Konsumstraße 8 42285 Wuppertal PKW ANKAUF : sie haben ein defektes Auto was sie verkaufen möchten ? Wir kaufen alle arten von defekte , egal ob Motorschaden Getriebeschaden oder Unfallschaden Jetzt Kontaktieren per Whatsapp +49 162 3103003 für sofort verkauf ! INSTRAGRAM @Maximumcars24 Haftungsausschluss für Angaben im online Inserat , da Tippfehler oder irrtum Möglich sind Sonderausstattung: Audio-Navigationssystem Business, Comfort-Paket, Dachreling schwarz, Instrumentenkombination (erweiterter Umfang), Metallic-Lackierung, Park-Distance-Control (PDC) vorn und hinten, Reifensystem Run-Flat (mit Notlaufeigenschaften), Sicht-Paket, Sitzheizung vorn Weitere Ausstattung: Airbag Fahrer-/Beifahrerseite, AUX-IN-Anschluss (AUX-IN), Außenspiegel elektr. verstell- und heizbar, Außenspiegel Wagenfarbe, Blinkleuchten Weiß, Bordcomputer, Bremsassistent, Bremsenergierückgewinnung (Rekuperationssystem), Check-Control-System, Drehzahlmesser, Durchladeeinrichtung (Mittelarmlehne hinten), Dynamische Bremsleuchte, Fahrassistenz-System: Fahrerlebnisschalter, Fensterheber elektrisch vorn + hinten, Freisprecheinrichtung mit USB-Schnittstelle, Fußmatten Velours, Heckleuchten LED, Innenausstattung: Interieurleisten Satin-Silber, matt, Isofix-Aufnahmen für Kindersitz an Rücksitz, Karosserie: 5-türig, Kopf-Airbag-System hinten, Kopf-Airbag-System vorn, Lenksäule (Lenkrad) mechan. verstellbar, LM-Felgen, Motor 2,0 Ltr. - 135 kW Turbodiesel, Multifunktion für Lenkrad, Nichtraucher-Paket, Reifenpannen-Anzeige, Schadstoffarm nach Abgasnorm Euro 5, Schaltpunktanzeige, Scheibenwaschdüsen heizbar, Seitenairbag vorn, Sitzbezug / Polsterung: Stoff Move, Sitze vorn höhenverstellbar, Start-Stop-Knopf, Start/Stop-Anlage (Funktion), Wärmeschutzverglasung getönt , Sitzheizung vorn Kombi Gebrauchtfahrzeug Beschädigt, Nicht fahrtauglich Hubraum: 1995 cm³ Anzahl der Türen: 4/5 Türen Anzahl Sitzplätze: 5 Schadstoffklasse: -- Umweltplakette: -- Anzahl der Fahrzeughalter: 2 HU: -- Farbe: Braun Metallic Farbe (Hersteller): HAVANNA METALLIC Innenausstattung: Vollleder Farbe der Innenausstattung: Schwarz Airbags: Front-, Seiten- und weitere Airbags Anhängerkupplung: -- Ausstattung ABS, Armlehne, Dachreling, ESP, Elektr. Fensterheber, Elektr. Seitenspiegel, Elektr. Wegfahrsperre, Freisprecheinrichtung, Isofix, Lederausstattung, Lederlenkrad, Leichtmetallfelgen, Multifunktionslenkrad, Navigationssystem, Nebelscheinwerfer, Partikelfilter, Servolenkung, Sitzheizung, Start/Stopp-Automatik, Zentralverriegelung Inserat bereitgestellt von",False,345083,März 2013,Diesel,Automatik,2026-06-06T23:39:48.957577
3426931034,BMW 320 d Sport Line ( Shadow Line ) Automatic,15.999 €,44809 Bochum-​Mitte,https://www.kleinanzeigen.de/s-anzeige/bmw-320-d-sport-line-shadow-line-automatic/3426931034-216-1938,Reserviert • Gelöscht • BMW 320 d Sport Line ( Shadow Line ) Automatic,15.999 €,15999,"BMW 320d – 2. Hand – Gepflegter Zustand • Sondermodell Sport Line Shadow Line • Aus zweiter Hand • Sehr gepflegter Zustand • Lückenlos scheckheftgepflegt bei BMW bis Januar 2025 • Aktueller Ölservice wird vor Übergabe frisch durchgeführt ✅ Inzahlungnahme Ihres Pkw möglich ✅ Finanzierung auch ohne Anzahlung möglich Sonderausstattung: Business-Paket, Fahrassistenz-System: Fernlichtassistent, HiFi-Lautsprechersystem, Induktionsladeschale für Smartphone (Wireless Charging), Innenausstattung: Interieurleisten schwarz hochglänzend mit Akzentleiste, Instrumentenkombination (erweiterter Umfang), LM-Felgen vorn/hinten: 8x18 / 8,5x18 (Doppelspeiche 397), Metallic-Lackierung, Park-Distance-Control (PDC) vorn und hinten, Raucher-Paket, Reifensystem Run-Flat (mit Notlaufeigenschaften), Scheinwerfer LED, Service-System: Concierge Services, Service-System: ConnectedDrive Services, Service-System: Real Time Traffic Information (RTTI), Service-System: Remote Services, Spiegel-Paket Weitere Ausstattung: Ablage-Paket, Airbag Beifahrerseite abschaltbar, Airbag Fahrer-/Beifahrerseite, Ambiente-Beleuchtung, Audiosystem BMW Professional (Radio/CD-Player MP3-fähig), Auspuffblende verchromt, schwarz, AUX-IN-Anschluss (AUX-IN), Außenspiegel elektr. verstell- und heizbar, Außenspiegel Wagenfarbe, Außentemperaturanzeige, Bordcomputer, Bremsassistent, Check-Control-System, Durchladeeinrichtung (Mittelarmlehne hinten), Dynamische Bremsleuchte, Dynamische Tractions Control (DTC), Einstiegsleisten mit Einleger in Aluminium, Fahrassistenz-System: Fahrerlebnisschalter, Farbmonitor (6,5 Zoll), Fernentriegelung Heckklappe, Freisprecheinrichtung Bluetooth mit USB-/Audio-Schnittstelle, Fußmatten Velours, Gepäckraum-Abtrennung (Netz), Gepäckraumabdeckung / Rollo, Getränkehalter, Heckklappenbetätigung automatisch, Heckleuchten LED, Isofix-Aufnahmen für Kindersitz, Karosserie: 5-türig, Klimaautomatik 2-Zonen mit autom. Umluft-Control, Kopf-Airbag-System hinten, Kopf-Airbag-System vorn, Kopfstützen hinten klappbar, Lenkrad (Sport/Leder), Lenksäule (Lenkrad) mechan. verstellbar, Licht-Paket, Mittelarmlehne hinten, Modellpflege, Motor 2,0 Ltr. - 140 kW 16V Turbodiesel, Multifunktion für Lenkrad, NOx-Speicherkatalysator (BMW Blue Performance), Personalisierungssystem (Personal Profile), Reifendruck-Kontrollsystem, Schadstoffarm nach Abgasnorm Euro 6, Seitenairbag hinten, Seitenairbag vorn, Service-System: Intelligenter Notruf inkl. TeleServices, Sitzbezug / Polsterung: Stoff Corner, Sport Line, Sportsitze vorn, Start-Stop-Knopf, Start/Stop-Anlage (Funktion), Steckdose (12V-Anschluß) zusätzlich, Wärmeschutzverglasung getönt , Ambiente-Beleuchtung Kombi Gebrauchtfahrzeug Unfallfrei Hubraum: 1995 cm³ Anzahl der Türen: 4/5 Türen Anzahl Sitzplätze: 5 Schadstoffklasse: Euro6 Umweltplakette: 4 (Grün) Anzahl der Fahrzeughalter: 2 HU: Neu Farbe: Schwarz Metallic Farbe (Hersteller): SAPHIRSCHWARZ Innenausstattung: -- Farbe der Innenausstattung: -- Airbags: Front-, Seiten- und weitere Airbags Anhängerkupplung: -- Tagfahrlicht (Art): Tagfahrlicht Ausstattung ABS, Abgedunkelte Scheiben, Alarmanlage, Ambiente-Beleuchtung, Armlehne, Bluetooth, Bordcomputer, CD-Spieler, ESP, Elektr. Fensterheber, Elektr. Heckklappe, Elektr. Seitenspiegel, Elektr. Wegfahrsperre, Freisprecheinrichtung, Garantie, Isofix, Lederlenkrad, Leichtmetallfelgen, Multifunktionslenkrad, Navigationssystem, Nebelscheinwerfer, Nichtraucher-Fahrzeug, Partikelfilter, Regensensor, Scheckheftgepflegt, Servolenkung, Sitzheizung, Sommerreifen, Sportsitze, Stahlfelgen, Start/Stopp-Automatik, Traktionskontrolle, USB, Winterreifen, Zentralverriegelung Inserat bereitgestellt von",False,119999,April 2018,Diesel,Automatik,2026-06-06T23:39:54.179880
3427592900,BMW E46 320D TÜV 01.27 fahrbereit,1.200 € VB,33102 Paderborn,https://www.kleinanzeigen.de/s-anzeige/bmw-e46-320d-tuev-01-27-fahrbereit/3427592900-216-2163,Reserviert • Gelöscht • BMW E46 320D TÜV 01.27 fahrbereit,1.200 € VB,1200,"Hallo, verkauft wird BMW E46 320D. Bitte Kein Neu Auto erwarten. FAHRBEREIT. Frischer Ölwechsel vor ca. 50 km Neue Reifen vorne und hinten DPF entfernt weil würde vorbereitet für Software Optimierung. „Bekannt ist lediglich ein kleines Masseproblem im Kofferraum, das gelegentlich zu einer Entladung der Batterie führen kann. Die Behebung sollte mit überschaubarem Aufwand möglich sein.“ Bei Interesse einfach anschreiben. Mit freundlichen Grüßen",False,287000,Juni 2003,Diesel,Manuell,2026-06-06T23:39:59.403863
3416760311,BMW 3er 320d (E46) Diesel,1.500 € VB,47441 Moers,https://www.kleinanzeigen.de/s-anzeige/bmw-3er-320d-e46-diesel/3416760311-216-2127,Reserviert • Gelöscht • BMW 3er 320d (E46) Diesel,1.500 € VB,1500,"Verkaufe hier meinen BMW 3er E46 320d als Schalter/Manuell. Verkaufen tu ich das Auto nur aufgrund von den Haltungskosten (bin noch Auszubildender). Das Fahrzeug ist Baujahr 1998, hat 136 PS und einen Dieselmotor. Das Auto ist fahrbereit/fahrtauglich, hat jedoch alters- und gebrauchsbedingte Mängel. Bekannte Mängel: * Schloss auf der Fahrerseite defekt * Rost vorhanden * Halterung der Scheinwerfer-Glühbirne defekt * Kratzer an der Beifahrertür (durch Fremdverschulden) * Querlenker vorne links * Einparkhilfe (Pieper) Kilometerstand bitte den Bildern entnehmen (kann sich noch ändern, da das Auto bis Verkauf noch genutzt wird) Motor und Getriebe laufen. Scheiben sind getönt (Schein auch enthalten) Verkauf erfolgt unter Ausschluss jeglicher Gewährleistung und Garantie, da Privatverkauf.",False,250000,November 1998,Diesel,Manuell,2026-06-06T23:40:04.828116
3427581674,"BMW 320d G20 Sportline, gepflegt, Motor neu, Tüv neu",22.990 € VB,59590 Geseke,https://www.kleinanzeigen.de/s-anzeige/bmw-320d-g20-sportline-gepflegt-motor-neu-tuev-neu/3427581674-216-1260,"Reserviert • Gelöscht • BMW 320d G20 Sportline, gepflegt, Motor neu, Tüv neu",22.990 € VB,22990,"Zum Verkauf steht ein gepflegter BMW 320d (G20) aus 2019 in einem sehr guten technischen und optischen Zustand. Das Fahrzeug überzeugt mit seinem sparsamen Dieselmotor, sportlichem Fahrverhalten und hochwertiger Ausstattung. Das Fahrzeug wurde regelmäßig gewartet und befindet sich technisch in einem einwandfreien Zustand. Ölwechsel und Inspektionen wurden stets durchgeführt. Innenraum sauber und gepflegt. Bei einer Laufleistung von 106000 km hat das Fahrzeug einen neuen Motor mit Turbolader erhalten, aufgrund eines technischen Defekts. Die Rechnung liegt vor. Es liegt noch eine BMW Repair Inclusive Garantie vor bis zum 04.07.2027 (BMW Reparaturkostenversicherung). Diese ist auf dem Käufer übertragbar. Bei Interesse gerne melden. Besichtigung und Probefahrt jederzeit nach Terminvereinbarung möglich. Privatverkauf, daher keine Garantie oder Rücknahme. Verkauf von Privat an Privat. Die Fahrzeugbeschreibung dient lediglich der allgemeinen Identifizierung des Fahrzeuges und stellt keine Gewährleistung im kaufrechtlichen Sinne dar. Die Angaben erheben nicht den Anspruch auf Vollständigkeit. Die gemachten Angaben/Beschreibungen und Bildern sind unverbindlich und dienen nicht als zugesicherte Eigenschaften. Der Verkäufer übernimmt keine Haftung/Gewährleistung für Tipp- und Datenübermittlungsfehler.",False,109000,November 2019,Diesel,Manuell,2026-06-06T23:40:10.349972
3427580749,"BMW 320d Sport Line G20, Top gepflegt, Tüv Neu",22.990 €,59590 Geseke,https://www.kleinanzeigen.de/s-anzeige/bmw-320d-sport-line-g20-top-gepflegt-tuev-neu/3427580749-216-1260,"Reserviert • Gelöscht • BMW 320d Sport Line G20, Top gepflegt, Tüv Neu",22.990 €,22990,"Zum Verkauf steht ein gepflegter BMW 320d (G20) aus 2019 in einem sehr guten technischen und optischen Zustand. Das Fahrzeug überzeugt mit seinem sparsamen Dieselmotor, sportlichem Fahrverhalten und hochwertiger Ausstattung. Das Fahrzeug wurde regelmäßig gewartet und befindet sich technisch in einem einwandfreien Zustand. Ölwechsel und Inspektionen wurden stets durchgeführt. Innenraum sauber und gepflegt. Bei einer Laufleistung von 106000 km hat das Fahrzeug einen neuen Motor mit Turbolader erhalten, aufgrund eines technischen Defekts. Die Rechnung liegt vor. Es liegt noch eine BMW Repair Inclusive Garantie vor bis zum 04.07.2027 (BMW Reparaturkostenversicherung). Diese ist auf dem Käufer übertragbar. Bei Interesse gerne melden. Besichtigung und Probefahrt jederzeit nach Terminvereinbarung möglich. Privatverkauf, daher keine Garantie oder Rücknahme. Verkauf von Privat an Privat. Die Fahrzeugbeschreibung dient lediglich der allgemeinen Identifizierung des Fahrzeuges und stellt keine Gewährleistung im kaufrechtlichen Sinne dar. Die Angaben erheben nicht den Anspruch auf Vollständigkeit. Die gemachten Angaben/Beschreibungen und Bildern sind unverbindlich und dienen nicht als zugesicherte Eigenschaften. Der Verkäufer übernimmt keine Haftung/Gewährleistung für Tipp- und Datenübermittlungsfehler. Limousine Gebrauchtfahrzeug Unfallfrei Hubraum: 1995 cm³ Anzahl der Türen: 4/5 Türen Anzahl Sitzplätze: 5 Schadstoffklasse: Euro6c Umweltplakette: 4 (Grün) Anzahl der Fahrzeughalter: 2 HU: 6/2028 Farbe: Schwarz Farbe (Hersteller): -- Innenausstattung: Teilleder Farbe der Innenausstattung: Schwarz Airbags: Front-, Seiten- und weitere Airbags Anhängerkupplung: -- Radio: Tuner/Radio Tagfahrlicht (Art): LED-Tagfahrlicht Kurvenlicht (Art): Kurvenlicht Ausstattung ABS, Allwetterreifen, Ambiente-Beleuchtung, Armlehne, Beheizbares Lenkrad, Berganfahrassistent, Bluetooth, Bordcomputer, ESP, Elektr. Fensterheber, Elektr. Seitenspiegel, Elektr. Sitzeinstellung, Elektr. Wegfahrsperre, Freisprecheinrichtung, Garantie, Geschwindigkeitsbegrenzer, Innenspiegel autom. abblendend, Isofix, Lederlenkrad, Leichtmetallfelgen, Lichtsensor, Multifunktionslenkrad, Nebelscheinwerfer, Nichtraucher-Fahrzeug, Notrufsystem, Partikelfilter, Regensensor, Reifendruckkontrolle, Scheckheftgepflegt, Servolenkung, Sitzheizung, Sportsitze, Sprachsteuerung, Spurhalteassistent, Start/Stopp-Automatik, Touchscreen, Traktionskontrolle, USB, Zentralverriegelung Der Preis ist Verhandlungsbasis. Privatanbieter 59590 Geseke Deutschland Inserat bereitgestellt von",False,109000,November 2019,Diesel,Manuell,2026-06-06T23:40:15.501704
3427566994,BMW E46 320d | 150 PS | Diesel | TÜV Neu,2.250 € VB,32423 Minden,https://www.kleinanzeigen.de/s-anzeige/bmw-e46-320d-150-ps-diesel-tuev-neu/3427566994-216-1764,Reserviert • Gelöscht • BMW E46 320d | 150 PS | Diesel | TÜV Neu,2.250 € VB,2250,"* EZ 06/2003 * 2.0 Diesel, 110 kW (150 PS) * 330.183 km * Schaltgetriebe * Schwarz * 5-Sitzer * Euro 3 * BMW Alufelgen * Fahrbereit 2250€ VB. Privatverkauf.",False,330000,Juni 2003,Diesel,Schaltgetriebe,2026-06-06T23:40:20.362156
3427568815,BMW E46 320d | 150 PS | Diesel | TÜV Neu,2.250 € VB,32423 Minden,https://www.kleinanzeigen.de/s-anzeige/bmw-e46-320d-150-ps-diesel-tuev-neu/3427568815-216-1764,Reserviert • Gelöscht • BMW E46 320d | 150 PS | Diesel | TÜV Neu,2.250 € VB,2250,"Zum Verkauf steht mein BMW E46 320d in Schwarz. Das Fahrzeug ist fahrbereit und eignet sich ideal als zuverlässiges Alltagsauto oder als solide Basis für E46-Liebhaber. Fahrzeugdaten: * BMW 320d Limousine (E46) * Erstzulassung: 03.06.2003 * Motor: 2.0 Diesel * Leistung: 110 kW (150 PS) * Hubraum: 1.995 cm³ * Getriebe: Schaltgetriebe * Farbe: Schwarz * Sitzplätze: 5 * Kraftstoff: Diesel * Schadstoffklasse: Euro 3 * Kilometerstand: ca. 330.183 km (kann sich noch ändern) * Bereifung: 205/55 R16 * TÜV: Neu Ausstattung / Zustand: * Original BMW Alufelgen * Elektrische Fensterheber * Servolenkung * Klimaanlage * Geräumige Limousine mit großem Kofferraum * Motor läuft, Fahrzeug ist fahrbereit Optischer Zustand: Alters- und laufleistungsbedingte Gebrauchsspuren vorhanden. Insgesamt gepflegte Erscheinung für das Alter. Preis: 2250€ VB. Bei Interesse gerne melden. Besichtigung und Probefahrt nach Absprache möglich. Privatverkauf,",False,330000,Juni 2003,Diesel,Schaltgetriebe,2026-06-06T23:40:25.611010
3427551392,BMW 320d Touring Sport Line Sport Line,4.900 €,32683 Barntrup,https://www.kleinanzeigen.de/s-anzeige/bmw-320d-touring-sport-line-sport-line/3427551392-216-1274,Reserviert • Gelöscht • BMW 320d Touring Sport Line Sport Line,4.900 €,4900,"Verkaufe hier meinen BWM 320d als Wildunfall Es sind viele Reperaturen in der letzen Zeit vorgekommen worden wie z.B Ölwechsel Und Alle Filter Inspektion Ansaugbrücke nussgestrahlt Radlager HR Bremsflüssigkeit Nun das den Schaden nicht reparieren wollen wollten wir uns ein Größeres Auto zulegen Kombi Gebrauchtfahrzeug Beschädigt Hubraum: 1995 cm³ Anzahl der Türen: 4/5 Türen Anzahl Sitzplätze: 5 Schadstoffklasse: Euro6 Umweltplakette: -- Anzahl der Fahrzeughalter: 4 HU: 4/2027 Farbe: Schwarz Metallic Farbe (Hersteller): -- Innenausstattung: Teilleder Farbe der Innenausstattung: Schwarz Airbags: -- Anhängerkupplung: Anhängerkupplung abnehmbar Radio: Tuner/Radio Tagfahrlicht (Art): Tagfahrlicht Pannenhilfe: Pannenkit Ausstattung ABS, Armlehne, Beheizbare Frontscheibe, Berganfahrassistent, Bluetooth, Bordcomputer, CD-Spieler, Dachreling, ESP, Elektr. Fensterheber, Elektr. Heckklappe, Elektr. Seitenspiegel, Freisprecheinrichtung, Gepäckraumabtrennung, Geschwindigkeitsbegrenzer, Isofix, Isofix Beifahrersitz, Lederlenkrad, Leichtmetallfelgen, Lichtsensor, Lordosenstütze, Multifunktionslenkrad, Navigationssystem, Nebelscheinwerfer, Notrufsystem, Panorama-Dach, Partikelfilter, Regensensor, Reifendruckkontrolle, Scheinwerferreinigung, Servolenkung, Sitzheizung, Sommerreifen, Soundsystem, Sportfahrwerk, Sportpaket, Sportsitze, Start/Stopp-Automatik, Traktionskontrolle, USB, Winterreifen, Xenonscheinwerfer, Zentralverriegelung Der Preis ist Verhandlungsbasis. Privatanbieter 32683 Barntrup Deutschland Tel.: +49 1514 1639225 Inserat bereitgestellt von",False,249000,Juli 2012,Diesel,Automatik,2026-06-06T23:40:30.913152
3427547958,BMW 320d Modern Line Modern Line,9.800 €,50321 Brühl,https://www.kleinanzeigen.de/s-anzeige/bmw-320d-modern-line-modern-line/3427547958-216-1158,Reserviert • Gelöscht • BMW 320d Modern Line Modern Line,9.800 €,9800,"Besondere Ausstattung : - Head-Up Display - Professional Navigation - Totwinkelassistent - 19 Zoll Sommerreifen - Neu Motoröl gewechselt - 12 fach Bereift ( Bei Bedarf ) Saphirschwarz Metallic, Leder Dakota Schwarz / Schwarz, Multifunktions Lederlenkrad, Interieurleisten Satinsilber matt, Automaticgetriebe Steptronic, Navigationssystem Professional, Head-Up Display, Speed Limit Info inkl Uberholverbotsanzeige, Dachhimmel anthrazit, Klimaautomatik, PDC vorne und hinten, Innen- und Außenspiegel automatisch abblendbar, Spurwechselwarnung, Geschwindgkeitsregelung mit Bremsfunktion, Xenonlicht für Abblend- und Fernlicht, Scheinwerfer Waschanlage, Fernlichtassistent, Adaptives Kurvenlicht, Regensensor und Automatische Fahrlichtsteuerung, Connected Drive Services, Concierge Service, Real Time Traffic Information, Limousine Gebrauchtfahrzeug Unfallfrei Hubraum: 1995 cm³ Anzahl der Türen: 4/5 Türen Anzahl Sitzplätze: 5 Schadstoffklasse: Euro5 Umweltplakette: 4 (Grün) Anzahl der Fahrzeughalter: 2 HU: -- Farbe: Schwarz Metallic Farbe (Hersteller): -- Innenausstattung: Vollleder Farbe der Innenausstattung: Schwarz Airbags: -- Anhängerkupplung: -- Radio: Tuner/Radio, Radio DAB Kurvenlicht (Art): Adaptives Kurvenlicht Ausstattung ABS, Alarmanlage, Armlehne, Berganfahrassistent, Bluetooth, Bordcomputer, CD-Spieler, ESP, Elektr. Fensterheber, Elektr. Seitenspiegel, Elektr. Wegfahrsperre, Fernlichtassistent, Geschwindigkeitsbegrenzer, Head-Up Display, Induktionsladen für Smartphones, Isofix, Lederausstattung, Lederlenkrad, Lichtsensor, Multifunktionslenkrad, Navigationssystem, Nebelscheinwerfer, Nichtraucher-Fahrzeug, Notrufsystem, Partikelfilter, Regensensor, Reifendruckkontrolle, Servolenkung, Sitzheizung, Skisack, Sommerreifen, Standheizung, Start/Stopp-Automatik, Totwinkel-Assistent, Traktionskontrolle, USB, Verkehrszeichenerkennung, Zentralverriegelung Der Preis ist Verhandlungsbasis. Privatanbieter 50321 Hürth Deutschland Tel.: +49 178 5104421 Inserat bereitgestellt von",False,200000,Juni 2013,Diesel,Automatik,2026-06-06T23:40:37.766698
3427545209,Auto BMW 320d,4.700 €,59269 Beckum,https://www.kleinanzeigen.de/s-anzeige/auto-bmw-320d/3427545209-216-1434,Reserviert • Gelöscht • Auto BMW 320d,4.700 €,4700,"BMW E91 320d Automatik zu verkaufen Verkaufe meinen BMW E91 320d Automatik in Schwarz. Fahrzeugdaten: * Baujahr: 2008 * Kilometerstand: 228.000 km * Diesel * Automatikgetriebe * TÜV bis 04/2027 * Schwarze Lederausstattung In letzter Zeit erneuert: ✅ Stoßdämpfer neu ✅ Wasserpumpe neu ✅ Thermostat neu ✅ Motoröl regelmäßig gewechselt Das Fahrzeug ist fahrbereit und befindet sich in einem gepflegten Zustand. Innenraum mit Lederausstattung, sauber und gut erhalten. Ideal als Familien- oder Alltagsfahrzeug. Besichtigung und Probefahrt nach Absprache möglich. Preis: 4.700 € VB Bei Interesse einfach melden. Privatverkauf, keine Garantie oder Rücknahme.",False,228000,November 2008,Diesel,Automatik,2026-06-06T23:40:42.887867
3427484453,BMW 320d Touring M Sport HUD H&K AHK,27.600 € VB,40599 Benrath,https://www.kleinanzeigen.de/s-anzeige/bmw-320d-touring-m-sport-hud-h-k-ahk/3427484453-216-2074,Reserviert • Gelöscht • BMW 320d Touring M Sport HUD H&K AHK,27.600 € VB,27600,"27600 Mwst.ausweisbar Dieser gepflegte BMW 320 Touring aus dem Jahr 2022 präsentiert sich in elegantem Schwarz mit nur einem Vorbesitzer und lückenloser Servicehistorie. Der kraftvolle Dieselmotor mit 190 PS und Heckantrieb bietet ein dynamisches Fahrerlebnis, während das Automatikgetriebe für komfortables Fahren sorgt. Die umfangreiche Ausstattung umfasst ein digitales Cockpit, Head-Up-Display und ein fortschrittliches Navigationssystem mit Apple CarPlay und Bluetooth-Konnektivität. Der Innenraum besticht durch Teillederausstattung in Schwarz, beheizbare Sportsitze mit elektrischer Verstellung und ein beheizbares Multifunktionslenkrad. Die 3-Zonen-Klimaautomatik sorgt für angenehmes Raumklima. Zahlreiche Fahrassistenzsysteme wie Spurhalteassistent, Kollisionsvermeidung, Totwinkelassistent und adaptive Kurvenscheinwerfer erhöhen die Sicherheit. Der Kombi bietet praktische Details wie eine elektrische Heckklappe, Dachreling und schwenkbare Anhängerkupplung. Euro 6d-temp Dieselmotor mit Start-Stopp-System Sportpaket und adaptive Fahrwerksregelung LED-Scheinwerfer mit Fernlichtassistent Automatisches Einparksystem mit Rückfahrkamera Schlüsselloser Zugang und elektrische Heckklappe Digitales Cockpit und Head-Up-Display Ambientbeleuchtung und Teillederausstattung DAB-Radio mit Soundsystem und WLAN-Hotspot Schwenkbare Anhängerkupplung (gebremst 1800 kg) Garantie und scheckheftgepflegt Servicearbeiten werden ausschließlich bei einem BMW Vertragspartner durchgeführt Sonderausstattung:Außenausstattung: Shadow-Line Hochglanz (erweiterter Umfang), BMW Live Cockpit Professional, Metallic-Lackierung, Sitzheizung vorn, Sitzlehnenbreitenverstellung vorn, Sonnenschutzverglasung (hinten abgedunkelt), Sound-System Harman-KardonWeitere Ausstattung:Ablage-Paket, Aerodynamik-Paket M-Technic, Airbag Beifahrerseite abschaltbar, Airbag Fahrer-/Beifahrerseite, Ausstattungs-Paket: Connected Professional, Außenausstattung: Shadow-Line Hochglanz, Außenspiegel elektr. verstell- und heizbar, Außenspiegel Wagenfarbe, BMW Live Cockpit Plus, Bordcomputer, Bremsassistent, DAB-Tuner (Radioempfang digital), Dachhimmel Anthrazit, Dachreling Hochglanz Shadow-Line, Diebstahlsicherung für Räder (Felgenschlösser), Durchladeeinrichtung (Mittelarmlehne hinten), Dynamische Bremsleuchte, Dynamische Stabilitäts-Control (DSC) mit erweiterter Umfang, Dynamische Tractions Control (DTC), Erste Hilfe-Kasten / Verbandkasten, Fahrassistenz-System: Active Guard Plus (Spurhalteassistent, Frontkollisionswarnung), Fahrassistenz-System: Aufmerksamkeits-Assistent, Fahrassistenz-System: Fahrerlebnisschalter, Fernentriegelung Heckklappe, Fußmatten Velours, Fußraumbeleuchtung vorn, Gepäckraum-Abtrennung (Netz), Gepäckraumbeleuchtung, Heckklappenbetätigung automatisch, Heckleuchten LED, Innenausstattung: Interieurleisten Alu Rhombicle mit Akzentleiste, Karosserie: 5-türig, Klimaautomatik 3-Zonen mit autom. Umluft-Control, Kopf-Airbag-System hinten, Kopf-Airbag-System vorn, Kopfstützen hinten klappbar, LM-Felgen, M Sport, Mild-Hybrid 140 kW (Motor 2,0 Ltr. - 140 kW Diesel), Modellpflege, Park-Distance-Control (PDC) vorn und hinten, Parkbremse elektrisch, Reifendruck-Kontrollsystem, Schadstoffarm nach Abgasnorm Euro 6d, Scheinwerfer LED, Seitenairbag hinten, Seitenairbag vorn, Sitzbezug / Polsterung: Alcantara / Sensatec-Kombination, Spiegel-Paket, Sport-Fahrwerk (M-Technic), Sportdifferential, Sportsitze vorn, Start/Stop-Anlage (Funktion), Variable Sportlenkung, Warndreieck, Widescreen Display, WärmeschutzverglasungDie Fahrzeugbeschreibung dient lediglich der allgemeinen Identifizierung des Fahrzeuges und stellt keine Gewährleistung im kaufrechtlichen Sinne dar. Die Angaben erheben nicht den Anspruch auf Vollständigkeit. Die gemachten Angaben/Beschreibungen und Bilder sind unverbindlich und dienen nicht als zugesicherte Eigenschaften. Der Verkäufer übernimmt keine Haftung/Gewährleistung für Tipp- und Datenübermittlungsfehler. Ausstattungen sind ggfs. gesondert zu prüfen.",False,149999,August 2022,Diesel,Automatik,2026-06-06T23:40:48.107184
