listing_id,search_title,search_price_text,location,url,title,price_text,price,description,posted_date,view_count,is_active,mileage_km,first_registration,fuel,transmission,scraped_at
3427363151,BMW 320 d Touring Sport Line* Shadow Line*,21.990 €,52477 Alsdorf,https://www.kleinanzeigen.de/s-anzeige/bmw-320-d-touring-sport-line-shadow-line-/3427363151-216-1714,BMW 320 d Touring Sport Line* Shadow Line*,21.990 €,21990,"BMW 320d Sport Line – EZ 06/2022 Moderner und sportlich ausgestatteter 3er mit umfangreichen Assistenzsystemen und lückenlos dokumentierter Servicehistorie. Komfortabel, effizient und bestens ausgestattet für Alltag und Langstrecke. Fahrzeugdaten ✅ Erstzulassung: 06/2022 ✅ Laufleistung: 142.846 km ✅ Halter: 2. Hand ✅ Getriebe: Automatik ✅ Scheckheft: gepflegt ✅ Letzter Service bei 124.446 km ✅ TÜV: 04/2027 Servicehistorie: Service bei 6 km Service bei 24.941 km Service bei 50.780 km Service bei 76.582 km Service bei 100.954 km Service bei 124.446 km Ausstattung & Highlights ✅ Sport Line ✅ Fahrassistenz-System: Active Guard (Bremsassistent) ✅ Active Guard Plus (Spurhalteassistent, Frontkollisionswarnung) ✅ Auffahrwarnsystem mit Bremsfunktion ✅ Aufmerksamkeits-Assistent ✅ Driving Assistant ✅ Fahrerlebnisschalter ✅ Fernlichtassistent ✅ Heckaufprall-Vermeidung ✅ Park-Assistent ✅ Querverkehrs-Assistent ✅ Rückfahr-Assistent ✅ Speed-Limit-Anzeige ✅ Spurwechsel-Warnsystem ✅ Aktiver Spurhalteassistent ✅ Frontscheibe Akustikglas ✅ Anhängerkupplung (Kugelkopf schwenkbar) ✅ Heckklappenbetätigung automatisch ✅ Rückfahrkamera Unsere Leistungen ✅ 1 Jahr Gewährleistung – Sie sind im ersten Jahr nach Kauf gegen technische Mängel abgesichert ✅ Finanzierung möglich – auch ohne Anzahlung ✅ Bundesweite Lieferung möglich ✅ Besichtigung & Probefahrt nach Absprache Änderungen / Irrtümer / Zwischenverkauf sind vorbehalten. - Anmeldeservice möglich! - Bundesweite Anlieferung möglich! Unsere Fahrzeuge werden für den Wiederverkauf professionell aufbereitet und in unserer Werkstatt auf Sicherheit und Zustand geprüft. - Finanzierung auch ohne Anzahlung möglich! - Inzahlungnahme möglich! Sonderausstattung: BMW Live Cockpit ConnectedDrive, Fahrassistenz-System: Driving Assistant, Fahrassistenz-System: Fernlichtassistent, HiFi-Lautsprechersystem, LM-Felgen 7,5x18 (V-Speiche 780, Bicolor), Metallic-Lackierung, Parkassistent-Paket, Sitzheizung vorn, Spiegel-Paket, Verglasung Akustikglas Weitere Ausstattung: Ablage-Paket, Airbag Beifahrerseite abschaltbar, Airbag Fahrer-/Beifahrerseite, Aktive Motorhaube, Ambiente-Beleuchtung, Auspuffanlage (2-Rohr-Anlage) mit Chromblenden, Außenausstattung: Shadow-Line Hochglanz, Außenspiegel elektr. verstell- und heizbar, Befestigungssystem im Kofferraum, Bordcomputer, Bremsassistent, DAB-Tuner (Radioempfang digital), Dachreling Hochglanz Shadow-Line, Diebstahlsicherung für Räder (Felgenschlösser), Durchladeeinrichtung (Mittelarmlehne hinten), Dynamische Bremsleuchte, Dynamische Tractions Control (DTC), Erste Hilfe-Kasten / Verbandkasten, Fahrassistenz-System: Active Guard (Bremsassistent), Fahrassistenz-System: Active Guard Plus (Spurhalteassistent, Frontkollisionswarnung), Fahrassistenz-System: Aufmerksamkeits-Assistent, Fahrassistenz-System: Fahrerlebnisschalter, Freisprecheinrichtung mit USB-Schnittstelle, Frontscheibe Akustikglas, Fußmatten Velours, Gepäckraum-Abtrennung (Netz), Heckklappenbetätigung automatisch, Heckleuchten LED, Innenausstattung: Interieurleisten, schwarz hochglänzend, Innenspiegel mit Abblendautomatik, Isofix-Aufnahmen für Kindersitz an Rücksitz, Karosserie: 5-türig, Klimaautomatik 3-Zonen mit autom. Umluft-Control, Kopf-Airbag-System hinten, Kopf-Airbag-System vorn, Kopfstützen hinten klappbar, Lenkrad (Sport/Leder) mit Multifunktion, Mild-Hybrid 140 kW (Motor 2,0 Ltr. - 140 kW Diesel), Mittelarmlehne hinten, Park-Distance-Control (PDC) vorn und hinten, Parkbremse elektrisch, Personalisierungssystem (Personal Profile), Reifendruck-Kontrollsystem, Rücksitzlehne geteilt/klappbar (40:20:40), Schadstoffarm nach Abgasnorm Euro 6d, Scheinwerfer LED, Seitenairbag vorn, Service-System: ConnectedDrive Services, Service-System: Gesetzlicher Notruf, Service-System: Intelligenter Notruf inkl. TeleServices, Sitzbezug / Polsterung: Stoff Sensatec, Sport Line, Sportsitze vorn, Start-Stop-Knopf, Start/Stop-Anlage (Funktion), Warndreieck Das AUTOCENTER in HOENGEN begrüßt sie gerne zu einer unverbindlichen Probefahrt oder Besichtigung. Eine Inzahlungnahme ihres derzeitigen Fahrzeuges ist möglich. Ständig neue und gepflegte Fahrzeuge im Sortiment. We speak English - Contact us by phone - WhatsApp Unsere Öffnungszeiten: Montag-Freitag : 10.00 Uhr - 18.00 Uhr Samstag : 10.00 Uhr - 16.00 Uhr Wir freuen uns auf ihren Besuch ! Kombi Gebrauchtfahrzeug Hubraum: 1995 cm³ Anzahl der Türen: 4/5 Türen Anzahl Sitzplätze: 5 Schadstoffklasse: Euro6 Umweltplakette: 4 (Grün) Anzahl der Fahrzeughalter: 2 HU: Neu Farbe: Schwarz Metallic Farbe (Hersteller): SAPHIRSCHWARZ Innenausstattung: -- Farbe der Innenausstattung: -- Airbags: Front-, Seiten- und weitere Airbags Anhängerkupplung: Anhängerkupplung schwenkbar Radio: Tuner/Radio, Radio DAB Tagfahrlicht (Art): LED-Tagfahrlicht Kurvenlicht (Art): Adaptives Kurvenlicht Pannenhilfe: Pannenkit Ausstattung ABS, Abstandswarner, Ambiente-Beleuchtung, Android Auto, Apple CarPlay, Armlehne, Berganfahrassistent, Blendfreies Fernlicht, Bluetooth, Bordcomputer, Dachreling, ESP, Elektr. Fensterheber, Elektr. Heckklappe, Elektr. Seitenspiegel, Elektr. Seitenspiegel anklappbar, Elektr. Wegfahrsperre, Fernlichtassistent, Freisprecheinrichtung, Garantie, Innenspiegel autom. abblendend, Inspektion neu, Isofix, Lederlenkrad, Leichtmetallfelgen, Lichtsensor, Lordosenstütze, Multifunktionslenkrad, Musikstreaming integriert, Müdigkeitswarner, Navigationssystem, Nebelscheinwerfer, Nichtraucher-Fahrzeug, Notbremsassistent, Notrufsystem, Partikelfilter, Regensensor, Reifendruckkontrolle, Schaltwippen, Scheckheftgepflegt, Scheinwerferreinigung, Servolenkung, Sitzheizung, Sommerreifen, Soundsystem, Sportpaket, Sportsitze, Sprachsteuerung, Spurhalteassistent, Start/Stopp-Automatik, Totwinkel-Assistent, Touchscreen, Traktionskontrolle, USB, Verkehrszeichenerkennung, Volldigitales Kombiinstrument, Zentralverriegelung Inserat bereitgestellt von",30.05.2026,147,True,142846,Juni 2022,Diesel,Automatik,2026-06-08T21:56:30.880760
3427359447,BMW 320 d Touring Sport Line Garantie *Head Up*LED*,15.990 €,52477 Alsdorf,https://www.kleinanzeigen.de/s-anzeige/bmw-320-d-touring-sport-line-garantie-head-up-led-/3427359447-216-1714,BMW 320 d Touring Sport Line Garantie *Head Up*LED*,15.990 €,15990,"BMW 320d Touring Sport Line Sportlicher und zugleich praktischer Kombi mit Sport Line Ausstattung, gepflegter Historie und umfangreicher Ausstattung. Fahrzeugdaten ✅ Erstzulassung: 08/2016 ✅ Laufleistung: 143.177 km ✅ Getriebe: Automatik ✅ Scheckheft: gepflegt (Wartungen beim Vertragspartner durchgeführt) ✅ Letzter Service: 10/2025 bei 138.913 km ✅ TÜV: bis 05/2027 Ausstattung & Highlights ✅ Sport Line Ausstattung ✅ Business-Paket ✅ Navigationssystem ✅ LED-Scheinwerfer ✅ LED-Tagfahrlicht ✅ Sitzheizung ✅ Park Distance Control vorne & hinten ✅ Freisprecheinrichtung (Bluetooth) ✅ Ambiente-Beleuchtung ✅ Klimaautomatik ✅ Tempomat ✅ 8-fach bereift (Sommer & Winter) ✅ Lackierung: Alpinweiß Wartung & Historie ✅ 28.07.2017 bei 24.478 km ✅ 12.12.2018 bei 51.978 km ✅ 07.05.2019 bei 59.191 km ✅ 09.07.2019 bei 64.890 km ✅ 28.04.2023 bei 115.417 km ✅ 27.10.2025 bei 138.913 km Komfort & Alltag ✅ Geräumiger Kofferraum ✅ Sportliches und komfortables Fahrverhalten ✅ Ideal für Familie & Langstrecke ✅ Weitere Ausstattung und Details siehe Bilder Unsere Leistungen ✅ 1 Jahr Gewährleistung – Sie sind im ersten Jahr nach Kauf gegen technische Mängel abgesichert ✅ Finanzierung möglich – auch ohne Anzahlung ✅ Inzahlungnahme Ihres Fahrzeugs möglich ✅ Besichtigung und Probefahrt nach Terminvereinbarung möglich Änderungen / Irrtümer / Zwischenverkauf sind vorbehalten. - Anmeldeservice möglich! - Bundesweite Anlieferung möglich! Unsere Fahrzeuge werden für den Wiederverkauf professionell aufbereitet und in unserer Werkstatt auf Sicherheit und Zustand geprüft. - Finanzierung auch ohne Anzahlung möglich! - Inzahlungnahme möglich! Sonderausstattung: Alpinweiß-Lackierung (Uni), Außen-/Innenspiegel mit Abblendautomatik, Head-up-Display, HiFi-Lautsprechersystem, Instrumentenkombination (erweiterter Umfang), Lenkrad heizbar, Paketkombination: Business-Paket in Verbindung mit Navigations-Paket ConnectedDrive, Park-Distance-Control (PDC) vorn und hinten, Scheinwerfer LED, Sitzheizung vorn, Sonnenschutzverglasung (hinten abgedunkelt) Weitere Ausstattung: Ablage-Paket, Airbag Beifahrerseite abschaltbar, Airbag Fahrer-/Beifahrerseite, Ambiente-Beleuchtung, Audiosystem BMW Professional (Radio/CD-Player MP3-fähig), Auspuffblende verchromt, schwarz, AUX-IN-Anschluss (AUX-IN), Außenspiegel elektr. verstell- und heizbar, Außenspiegel Wagenfarbe, Außentemperaturanzeige, Bordcomputer, Bremsassistent, Check-Control-System, Durchladeeinrichtung (Mittelarmlehne hinten), Dynamische Bremsleuchte, Dynamische Tractions Control (DTC), Einstiegsleisten mit Einleger in Aluminium, Fahrassistenz-System: Fahrerlebnisschalter, Farbmonitor (6,5 Zoll), Fernentriegelung Heckklappe, Freisprecheinrichtung Bluetooth mit USB-/Audio-Schnittstelle, Fußmatten Velours, Gepäckraum-Abtrennung (Netz), Gepäckraumabdeckung / Rollo, Getränkehalter, Heckklappenbetätigung automatisch, Heckleuchten LED, Innenausstattung: Interieurleisten schwarz hochglänzend mit Akzentleiste, Isofix-Aufnahmen für Kindersitz, Karosserie: 5-türig, Klimaautomatik 2-Zonen mit autom. Umluft-Control, Kopf-Airbag-System hinten, Kopf-Airbag-System vorn, Kopfstützen hinten klappbar, Lenkrad (Sport/Leder), Lenksäule (Lenkrad) mechan. verstellbar, Licht-Paket, LM-Felgen, Mittelarmlehne hinten, Modellpflege, Motor 2,0 Ltr. - 140 kW 16V Turbodiesel, Multifunktion für Lenkrad, NOx-Speicherkatalysator (BMW Blue Performance), Personalisierungssystem (Personal Profile), Reifendruck-Kontrollsystem, Reifensystem Run-Flat (mit Notlaufeigenschaften), Schadstoffarm nach Abgasnorm Euro 6, Seitenairbag hinten, Seitenairbag vorn, Service-System: Intelligenter Notruf inkl. TeleServices, Sitzbezug / Polsterung: Stoff Corner, Sport Line, Sportsitze vorn, Start-Stop-Knopf, Start/Stop-Anlage (Funktion), Steckdose (12V-Anschluß) zusätzlich, Wärmeschutzverglasung getönt , Head-up-Display, Sitzheizung vorn, Ambiente-Beleuchtung Das AUTOCENTER in HOENGEN begrüßt sie gerne zu einer unverbindlichen Probefahrt oder Besichtigung. Eine Inzahlungnahme ihres derzeitigen Fahrzeuges ist möglich. Ständig neue und gepflegte Fahrzeuge im Sortiment. We speak English - Contact us by phone - WhatsApp Unsere Öffnungszeiten: Montag-Freitag : 10.00 Uhr - 18.00 Uhr Samstag : 10.00 Uhr - 16.00 Uhr Wir freuen uns auf ihren Besuch ! Limousine Gebrauchtfahrzeug Hubraum: 1995 cm³ Anzahl der Türen: 4/5 Türen Anzahl Sitzplätze: 5 Schadstoffklasse: Euro6 Umweltplakette: 4 (Grün) Anzahl der Fahrzeughalter: 2 HU: Neu Farbe: Weiß Farbe (Hersteller): ALPINWEISS III Innenausstattung: Stoff Farbe der Innenausstattung: -- Airbags: Front-, Seiten- und weitere Airbags Anhängerkupplung: -- Radio: Tuner/Radio Tagfahrlicht (Art): LED-Tagfahrlicht Pannenhilfe: Pannenkit Ausstattung ABS, Abgedunkelte Scheiben, Alarmanlage, Ambiente-Beleuchtung, Armlehne, Beheizbares Lenkrad, Berganfahrassistent, Bluetooth, Bordcomputer, CD-Spieler, ESP, Elektr. Fensterheber, Elektr. Heckklappe, Elektr. Seitenspiegel, Elektr. Seitenspiegel anklappbar, Elektr. Wegfahrsperre, Freisprecheinrichtung, Garantie, Gepäckraumabtrennung, Geschwindigkeitsbegrenzer, Head-Up Display, Innenspiegel autom. abblendend, Inspektion neu, Isofix, Lederlenkrad, Leichtmetallfelgen, Lichtsensor, Multifunktionslenkrad, Navigationssystem, Nebelscheinwerfer, Nichtraucher-Fahrzeug, Notbremsassistent, Partikelfilter, Regensensor, Reifendruckkontrolle, Scheckheftgepflegt, Servolenkung, Sitzheizung, Sommerreifen, Soundsystem, Sportfahrwerk, Sportpaket, Sportsitze, Start/Stopp-Automatik, Touchscreen, Traktionskontrolle, USB, Verkehrszeichenerkennung, Winterreifen, Zentralverriegelung Inserat bereitgestellt von",02.06.2026,200,True,143177,August 2016,Diesel,Automatik,2026-06-08T21:56:36.689672
3430093295,"BMW Cabrio 320d Leder, Xenon, Memory, Navi",10.500 €,48163 Mecklenbeck,https://www.kleinanzeigen.de/s-anzeige/bmw-cabrio-320d-leder-xenon-memory-navi/3430093295-216-17020,"BMW Cabrio 320d Leder, Xenon, Memory, Navi",10.500 €,10500,"Fahrzeug-Nr. für Kundenanfragen: 15346 Das Fahrzeug ist unfallfrei sowie Scheckheft gepflegt Sonderausstattung: Audio-Navigationssystem Business, Comfort-Paket, Innenausstattung: Interieurleisten, schwarz hochglänzend, LM-Felgen 8x17 (V-Speiche 338), Sitzbezug / Polsterung: Leder Dakota, Sitzheizung vorn, Sprachbediensystem, USB-Schnittstelle Weitere Ausstattung: Airbag Fahrer-/Beifahrerseite, Aktive Kopfstützen, Außenspiegel elektr. verstellbar, Außenspiegel heizbar, Außenspiegel mit Bordsteinautomatik, rechts, Außenspiegel Wagenfarbe, Außentemperaturanzeige, Blinkleuchten Weiß, Bordcomputer, Bremsenergierückgewinnung (Rekuperationssystem), Check-Control-System, Dachhimmel Anthrazit, Drehzahlmesser, Easy-Entry-Funktion, Frontscheibe mit Bandfilter oben, Hardtopdach (elektr. versenkbar), Innenbeleuchtungs-Paket, Isofix-Aufnahmen für Kindersitz an Rücksitz, Karosserie: 2-türig, Kopfstützen hinten, Lenkrad (Sport/Leder) mit Multifunktion, Lenksäule (Lenkrad) mechan. verstellbar, Modellpflege, Motor 2,0 Ltr. - 135 kW Turbodiesel KAT, Reifendruck-Kontrollsystem, Reifenpannen-Anzeige, Reifensystem Run-Flat (mit Notlaufeigenschaften), Rücksitzlehne klappbar, Schaltpunktanzeige, Scheibenwaschdüsen heizbar, Seitenairbag vorn, Sitze vorn elektr. verstellbar (links mit Memory), Soft-Close-Automatik für Kofferraum / Heckklappe, Start-Stop-Knopf, Start/Stop-Anlage (Funktion), Stoßfänger Wagenfarbe, Wärmeschutzverglasung (Frontscheibe mit Bandfilter oben), Sitzheizung vorn Kfz Service und Handel Karimov GmbH Daimlerweg 39-41 48163 Münster Tel: Mobil: +491601891488 Cabrio/Roadster Gebrauchtfahrzeug Unfallfrei Hubraum: 1995 cm³ Anzahl der Türen: 2/3 Türen Anzahl Sitzplätze: 4 Schadstoffklasse: Euro5 Umweltplakette: 4 (Grün) Anzahl der Fahrzeughalter: 2 HU: 9/2027 Farbe: -- Farbe (Hersteller): -- Innenausstattung: Vollleder Farbe der Innenausstattung: Schwarz Airbags: Front- und Seiten-Airbags Anhängerkupplung: -- Tagfahrlicht (Art): Tagfahrlicht Ausstattung ABS, ESP, Elektr. Fensterheber, Elektr. Seitenspiegel, Elektr. Sitzeinstellung, Isofix, Lederausstattung, Lederlenkrad, Leichtmetallfelgen, Multifunktionslenkrad, Navigationssystem, Nebelscheinwerfer, Nichtraucher-Fahrzeug, Partikelfilter, Regensensor, Scheckheftgepflegt, Servolenkung, Sitzheizung, Start/Stopp-Automatik, USB, Xenonscheinwerfer, Zentralverriegelung Inserat bereitgestellt von",28.05.2026,39,True,234564,Mai 2012,Diesel,Manuell,2026-06-08T21:56:45.096662
3430361256,BMW 320d touring E91 zu verkaufen,3.700 € VB,52351 Düren,https://www.kleinanzeigen.de/s-anzeige/bmw-320d-touring-e91-zu-verkaufen/3430361256-216-1768,BMW 320d touring E91 zu verkaufen,3.700 € VB,3700,Verkaufe wegen Neuanschaffung unseren treuen BMW. Technisch einwandfrei. Natürliche Gebrauchtspuren. Nicht ein einziges Mal im Stich gelassen. Bitte keine Anfragen mit Letzte Preis.,04.06.2026,69,True,274000,November 2009,Diesel,Automatik,2026-06-08T21:56:51.426690
3430321774,BMW 320d f30,9.500 €,33100 Paderborn,https://www.kleinanzeigen.de/s-anzeige/bmw-320d-f30/3430321774-216-2164,BMW 320d f30,9.500 €,9500,"Ich verkaufe meinen BMW 320d f30, Das Fahrzeug ist in einem sehr guten und gepflegten Zustand. Es wurde regelmäßig gewartet und ist technisch einwandfrei. Nichtraucherfahrzeug und unfallfrei. TÜV gültig bis 2028. Der Verkauf erfolgt, da wir in der Familie ein Fahrzeug mit Automatikgetriebe benötigen. Preis ist verhandelbar. Bei Interesse gerne melden.",24.05.2026,101,True,198000,Mai 2012,Diesel,Manuell,2026-06-08T21:56:57.241325
